id,socre,doc,result,Precision,,AP
1,0.682524264,Privacy. Just look below to all of the data that Facebook uses that is linked to you for their profit.big thumbs down.,1,1,1,1
2,0.634374499,They just care about selling your personal info. All they care about is how much of your personal information they can gather and sell. Facebook has went way downhill since it first started I only used it mainly for selling on marketplace and business networking but now i wont even be using it for that after they removed my latest marketplace item for no reason when i have been buying and selling on marketplace for years and have a 5 star rating Facebook is worthless,1,1,1,1
3,0.629657686,Facebook is Privacy nightmare. FB will sell your soul (or data) to the devil for a few cents if they could If you read their new terms of service you would be terrified. You have no privacy for you or anything on your phone,1,1,1,1
4,0.628310919,Biased. Facebook sells your private information to third party companies. It tracks you and send those information to third party companies as well. It is selective and may remove your post with dictated nonsense reasons.,1,1,1,1
5,0.627515614,"Invasive, Avoid at all costs. Bias party and concerning privacy breaches. UPDATE: So I had this one individual contact me condescendingly about how much he doesnt like the price at which Im selling something at marketplace and then reports me, facebook without gathering any data terminates my account. Facebook has grown to be a disease to our nation and individuality. Privacy is not respected whatsoever, the most invasive site on the web next to google.Avoid facebook. Its only value was the marketplace and the ability to save game data. The measures they take to collect your information is concerning.",1,1,1,1
6,0.626541257,"Facebook. FB hides under a free social communication tool. They track us, they locate us, they algorithm our social and mental acuity - I own a marketing agency and while I need Facebook to market our clients products - I know what they are. There are so many privacy infringement violations and social travesties. They will continue to hold society hostage and thus my agency will continue to thrive sigh.",1,1,1,1
7,0.621930778,"Privacy. Facebook are made it easy to steal people privacy. It is creepy because they can spy on your websites. Moreover, they hand the info to a third and fourth parties ...etc. It is all about business and we are for sale by the company. Shame on Facebook.",1,1,1,1
8,0.618765235,"Your personal information is opened for sell. Beware, you are like a sell cow in catalog, and facebook selling all information and doesn't care you anymore",1,1,1,1
9,0.615373909,Privacy Violations. Download your data and you will learn things about you that Facebook shouldnt know.,1,1,1,1
10,0.612761319,"SS#, Birth Certificate and ID Required. I have heard if you try to change your name on FB that they need pictures of that I didnt believe it. Well my friend needed some money and I was going to send her $20 and FB told me that in order for me to send the money they needed my SS#, a picture of my birth certificate and my ID. I didnt know that a social platform needed access to these things? I, of course denied it. People have said that FB will lock you out of your account if you do not provide these things. But I think for a social platform they are asking too much. Its just suppose to be a way for us to keep connected. Not something that they need our information like that.",1,1,1,1
11,0.607975721,Do You Like Privacy?. If you like privacy you will delete you Active Facebook Account. Facebook sells personal data to malicious third party groups and other malicious groups.Dont use Facebook.,1,1,1,1
12,0.602061927,Tech support and selling your information. Tech support is horrible not to mention they allow companies to use your information. Facebook is evil on many levels but screening and filtering to their benefit is #1 priority.,1,1,1,1
13,0.593958199,Bias party and concerning privacy breaches. Avoid facebook. Its only value was the marketplace and the ability to save game data. The measures they take to collect your information is concerning.,1,1,1,1
14,0.593092978,"Facebook Uses You. There are well detailed complaints already posted about the failings of Facebook. We\'ve long been aware of the crimes and offenses of the Zuckerberg- lead company. Our hope is that their spying, stealing, and general indifference to you and us catches up with them, and that they come to realize their egregious offenses, which are perpetrated against us, freedom, and the privileges they enjoy but deprive of others, such as privacy. Bravo to those ex-Facebook employees who have spoken out against this corrupted company.",1,1,1,1
15,0.59253639,"No privacy, no rights. Facebook is a very invasive app into you privacy, it snoops into your online shopping and then bombardes you with ads. There is no freedom of speech and there is not a group for everyone, if Facebook doesnt like your thing they ban it. You have zero rights with this terrible company. DO NOT JOIN",1,1,1,1
16,0.589146495,"Bad for you. Bad for everybody. Just ask yourself: how does a company which trades in your personal, private business make so much money? Heck, just do a search and see. Social media has been bad for children, adults, entire continents. Its not hyperbolic, when you think of the number of folks using this service. And Facebook (Meta good luck with that rebranding PR), of all social media, has been the absolute worst. Users should have figured that out when Zuck laughed about people being stupid, handing over personal, private information. We left FB in 2009 (about the time they claimed copyright over every photo, video, thought, posted) and have looked on from the sidelines as the world just kinda forgot? how to be civil?  And now FB is just a great place to about into a loud echo chamber with only like-minded. Real growth there, folks. Super job shepherding humanity into the 21st century.  Do yourselves a favor: quit. Free is never free. And Facebook is just plain bad for people. It is. (Also, if our personal information is worth so much, why cant we see it? Why arent we allowed to review it? Lastly, why cant we sell it ourselves? Letting some third party in your home to steal your privacy is just stupid.)",1,1,1,1
17,0.588709712,No privacy. The problem with Facebook and all social media that your information is everywhere. They sell your information. And they also give the government your information.. its not about gather with friends. Your data is sold The same thing goes for Google . Listen to your Conversations and report back to there makers. A database is made. They can use this to incriminate you . Even if you havent done anything wrong. Youre signing your life away and you dont even know it. They are contracts you cant even read them. It would take you weeks to read . Even if you delete your account it doesnt guarantee the use doesnt guarantee you complete 100% delete of your data its sold . Dont be fooled. believing youre safe. Your address and phone number out there. Why do you think so many people your phone number. Think about before you sign,1,1,1,1
18,0.583473861,Steals your data to make money. You are their product and they make money out of you. It should not be Facebook it should be called .. you know.,1,1,1,1
19,0.578003526,"PRIVACY. What happened to yall protecting our PRIVACY?Why is there a need to know all our dang DATA?, including health and fitness, finances, contacts, browsing history, usage data, precise location, search history, purchases, diagnostics, identifiers, and other sensitive information. Do something about it, because we deserve to have a certain amount of privacy on these apps and FB is not providing it This is poor servicing",1,1,1,1
20,0.57398355,"Easy Access, Uncensored, and Unprivate. I give one star to FACEBOOK, because any knowledgeable hacker can hack your profile on this website it is NOT PRIVATE it can be easily accessed of your account your PICTURES, your IDENTITY and any messages sent via MESSENGER can be accessible on FACEBOOK so if your looking for privacy my suggestion and advice dont seek SOCIAL MEDIA.",1,1,1,1
21,0.568728387,Facebook is not a good company. Gathering info on its client base and selling this information to the highest bidder is an evil practice. Facebook is a company that takes advantage of its users and attempts to manipulate public opinion and police thought. Screw these guys,1,1,1,1
22,0.56598109,"Steals everything. Facebook just steals all your info , sells it you get nothing but spam and adds in return .",1,1,1,1
23,0.564388037,They steal too much information. Do your research in what Facebook its bias and unsafe and tracks everything you do kinda like iPhones and Google,1,1,1,1
24,0.563750744,facebook is cancer to society. Years and years of user data collection and privacy issues on a platform that caters to instigation and division.,1,1,1,1
25,0.563478172,"FCc. You are not allowed to track personal details on our accounts. I am reporting facebook and all the requests to review things that don't work.  I hide things and it doesn't work, disable doesn't work basically Facebook is old and nothing works goodbye FB done had to give a star or it wouldn't post. I would give negative 500000",1,1,1,1
26,0.563000977,No privacy. I was checking my privacy sitting and I found out that Facebook has been recording all my web browsers history( Microsoft edge and Google Chrome) be extra careful from this awful platform META,1,1,1,1
27,0.561923623,No privacy. I wouldnt download useless you want to be tracked by Facebook,1,1,1,1
28,0.559556067,Steals Information. Making Facebook required to run devices and apps owned by the user while Facebook steals private information should be illegal.,1,1,1,1
29,0.558428884,"Facebook manipulates you. Facebook preys on your emotions to get you to use their services more frequently, and for their own profit. Dont be used by anyone. Do not use their services any longer.",1,1,1,1
30,0.558305681,"Should be criminal activity. Blatantly tries to steal your user data to seek for a profit. Im not saying other websites dont do the same, but Facebook goes farther and acts more entitled than any other group/company I can think of.",1,1,1,1
31,0.556995213,"Facebook cares ;). If youre looking for a single location where companies cane mine data about who you are and what you do, and of course how you think, this is the app for you. Not only can you train an ai to recognize yours and your acquaintances faces, as well as attribute that data to your views and reluctant needs, but you can create a web of data to pigeon hole yourself into the projected personas you created, and any possible way that corporations can market yo your deepest insecurities. What do you have to lose?",1,1,1,1
32,0.55696398,Facebook selling our information. Its really bad.,1,1,1,1
33,0.556571782,FB DOES NOT WANT TO PROTECT YOUR PRIVACY. FB will do anything they can to get all information on you and sell it. They make it impossibly difficult and confusing to change your privacy settings. Its laid out that way so most people (especially the older crowd) cant figure out. Much better social media apps out there. Use something else FB is dead,1,1,1,1
34,0.552114666,"Facebook reality. Facebook has changed a lot now, they  try to control what you see and share, they restrict your account when they feel or want to without you making something bad, wish we could be free to share our thoughts like we used to do before.",0,0.970588235,0,0.970588235
35,0.550724804,"I hate that I need it. Facebook steals all my personal information but because of business, I have no choice but to use it. If youre a manager please try other apps for your work groups.",1,0.971428571,0.971428571,0.970612245
36,0.549184561,"Not for Privacy. Over and over and over Facebook has proven they care nothing about their customers. Privacy is not one of their concerns as they collect and sell everything you see, search, post and share. Ive been with them for since the beginning but Im done with them and their corrupt evil ways. Id rather pay for a secure app than sell my soul for this free app remember, nothing is free. As the app is becoming overrun with pedophilia, political censorship, elimination of personal thoughts and limiting everyones freedoms of speech I will just distance myself from these types of people and behaviors. God Bless America",1,0.972222222,0.972222222,0.970656966
37,0.548081398,Intrusive. I dont feel my privacy is valued. But everyone insists on doing everything on Facebook so either I download it or be left out of everything.,1,0.972972973,0.972972973,0.970719561
38,0.547229052,"Facebooks CEO,admins, ignorance and carelessness. Facebook is not safe anymore. Nobody can have personal online privacy without local or unknown people placing their force fed unwanted advertising or personal blogging junk on others newsfeeds. Nobody can express themselves and their entitled opinions anymore without someone feeling so offended that they have to cry like a little 5 yr to Facebook admins as if the sky was about to fall on them. Facebooks community standards are nothing but a joke. Whats the purpose of having Facebook, Twitter and so on if one cant enjoy themselves safely and securely?",1,0.973684211,0.973684211,0.970797578
39,0.547101021,"Individuals believe that the database and privacy security features can be further improved. Facebook is praiseworthy of bringing convenience to the Internets social platforms, but at the same time there are also some areas that can further improve privacy and information security functions in social and media, and there are better defenses on data platforms.",1,0.974358974,0.974358974,0.970888896
40,0.546172321,Tracking and Stalking. They track everything. Its like having a personal stalker. Why do they need so much info on us? Will not continue with FB. I hope FB dies and Suckerburger loses all his money.,1,0.975,0.975,0.970991674
41,0.546167016,"Trojan horse. Facebook will become a trillion dollar company because of ALL the information they have on each and everyone of you. Be careful, if its free, you Are the product",1,0.975609756,0.975609756,0.97110431
42,0.546146929,"Completely Policed and Suffocates Freedom of Speech. The only benefit Facebook still has is connecting with friends and family I know closely. Other than that, they use their algorithms to tag normal factual things you post or say regarding current topics as false or requiring fact checking if they are contrary to Facebooks agenda. The few good things it provides are severely outweighed by all the toxic fear-mongering topics that are shared in accordance with Facebooks agenda. And good luck if you have facts or opinions that contradict this agenda youll be labeled as a false information spreader. Facebook is doing nothing but stressing people out and causing them to become more polarized and divided than ever. Shame on you, Facebook",0,0.952380952,0,0.947982779
43,0.545382977,Censorship and ads. I dont use Facebook much anymore. Their censoring and phony fact checking ends any discussion of the high-impact issues. Even murmuring to yourself gets you a bunch of ads related to what you murmured about.  I still post pictures of vacation and the dogs.,0,0.930232558,0,0.925936668
44,0.543818593,Tony p. Apple made it so permission is needed to track what I look at on other sites yet its pretty obvious youre not following this. I like what Facebook fundamentally stands for originally but its getting to the point where the constant tracking of everything I look at is getting old how about a reply from you explaining this,1,0.931818182,0.931818182,0.926070338
45,0.543338537,Garbage. Facebook is no longer safe in any way Dont put up pictures because they are now property of Facebook and you no longer have rights (even a picture of your own child). Any information is sold about you to whoever wants to pay or it. COMPLETE SECURITY BREACH,1,0.933333333,0.933333333,0.926231738
46,0.542378187,"Spyware. Facebook app is spyware. Just read the privacy section of the app store description for this app, and see for yourself how much this app collects information about and from you.",1,0.934782609,0.934782609,0.926417627
47,0.541002452,Horrible privacy. I cant stress enough how bad mark Zuckerberg and the rest of Facebook is with privacy. Thanks for exposing our credit cards and other data,1,0.936170213,0.936170213,0.926625129
48,0.540174961,Restricting/Banning. Facebook is restricting and banning accounts for sharing information from their own platform.  Regular users should not be attacked for sharing content that you allow on your platform.  The originator of the material should be the individual(s) in question.,0,0.916666667,0,0.907320438
49,0.539958119,Privacy exposure. I advice every Facebook user to delete the app and deactivate their account. I just found out that so many people private messages and pictures are being monitored by the administration. I saw my naked videos and pictures in a database since I started looking into it. A word for the wise is quite sufficient,1,0.918367347,0.918367347,0.907545886
50,0.539689779,"Zero customer care. Like many, my FB account was hacked and it was an absolute violation of my privacy.   Facebook allows hackers to advertise, then steal your account, and Facebook does NOTHING.  Facebook / Meta whatever he calls his company - is the worst of the worst of the worst.   Would NEVER do anything Zuckerberg offers again.  Lesson learned.",1,0.92,0.92,0.907794968
51,0.539124191,Privacy is Nonexistent. I am hoping to see Facebook broken up.,1,0.921568627,0.921568627,0.90806504
52,0.538878977,Privacy concerns. FB has become quite the big brother monitoring everything you do it seems-  targeting ads off things it apparently sees and hears you do outside of the app,1,0.923076923,0.923076923,0.90835373
53,0.537549078,"The People make this app Entertaining. Other than that, they steal your data. From who you are, where you live, your address, your phone number, your location. Your contacts, your email address. In some cases your credit card information. They track what you do. What you view on online stores. You can personalize the ads yes. Facebook also controls the ads you see on YouTube, Google, Amazon, Etc. I always deactivate my profile until I log back in for it to reactivate. Thats your best bet. If you dont use Facebook. Just do that, dont just delete the app. Youll be surprised how easy it is to find out information about someone. If they have a Facebook account. Even if you havent used your profile in 10+ years. It is still there..just deactivate it.",1,0.924528302,0.924528302,0.90865891
54,0.534546494,Facebook. Facebook sells your information. Its not a trusted site. Really should dismantled.,1,0.925925926,0.925925926,0.90897867
55,0.533676267,"Thank you Apple for guarding our privacy. Over the past year, Facebooks true intentions have been revealed. The world finally has gotten a glimpse at the man behind the curtain (a certain freckle skinned curly haired young CEO). Facebook does not care about choice, disclosures, or privacy. They want to control the entire experience. Many thanks to Apple for standing up to this very corrupt company and making it so users have a choice about such things as tracking. My only suggestion is to Apple: stop with the soft language when asking users if they wish to allow an app to track. To Facebook: your day of reckoning is upon you. The cat is out of the bag and the world is fully aware of your despicable behavior. Users are shutting down your tracking ability, advertisers are reconsidering their allotted Facebook advertising budgets, and Congress is debating how to real you in.",1,0.927272727,0.927272727,0.909311289
56,0.533107936,Dear Facebook. Stop selling my data and info pls,1,0.928571429,0.928571429,0.90965522
57,0.53178668,Zero privacy. Zuckerberg has the money/power to do what he wants with our information think about it,1,0.929824561,0.929824561,0.910009068
58,0.530762255,"Censorship, Propaganda and Ads. Facebooks main product is their users time. Its getting old.",0,0.913793103,0,0.894319257
59,0.530204535,"Feed mess, privacy mess, profit first mess. The FB/Meta platform doesnt create goodwill towards the community.  Instead, privacy breakdowns and lack of transparency to its valued assets, people, are not followed.  This issue is across their entire product line.  They havent proven themselves as trustworthy and dont make themselves accountable internally.",1,0.915254237,0.915254237,0.894674087
60,0.528891563,Help me understand. Why do I need to provide my card information to redownload Facebook? I dont make purchases from it so why does it need my account information to login???,1,0.916666667,0.916666667,0.89504063
61,0.52864939,I just hate Facebook. Its about privacy. At this point Im using it because forced by coworker and my job.,1,0.918032787,0.918032787,0.89541755
62,0.527392149,"Invasive, pandering to insecurities, mining info for advertising galore. Impossible to remove your information from.  Already an unethical amount of data on my child housed here via others comments and pictures (Facebook has created a ghost profile of her already).  Clearly between this and Instagram its designed to be as addictive as possible.  Shame our youth are allowed to waste their times on it. Creating a generation of insecurities.  Facebook was found to intentionally pander to negativity for clicks and add revenue.",1,0.919354839,0.919354839,0.895803636
63,0.527363837,Facebooks Inability to Privatize Profile Is Disgusting. The fact that they allow photos of my kids out float out there without my permission is absolutely horrendous. The photos are not from any family members. They are school pictures that allow name labeling without our permission.Facebook will sell your data to the next highest bidder. Run away from this app.,1,0.920634921,0.920634921,0.896197783
64,0.525314927,"Censorship. If you love to be told what to believe, have your beliefs swayed by elitist morons, and have your opinions and facts censored, Facebook is the app for you.FB is a communist platform that only allows the mainstream narrative.",0,0.90625,0,0.882194693
65,0.524729609,DANGEROUS SPYING WITHOUT USER PERMISSION. Pretty gross how Facebook was recently proven to collect plenty of user data without your permission and then use it against you,1,0.907692308,0.907692308,0.882586964
66,0.524309039,"Adapt or Die. Facebook needs a new business model, since the one it helped invent is now known as cyber-stalking. It&#39;s great that they helped the world realize this is a boundary, but they have yet to adapt to said realization. They intentionally do not allow you to update the photos they have access to from the app. If you cannot select which photos you want to share with them, you may be more inclined to share all of your photos out of convenience. Given their business is based on nonconsensual data harvesting, it&#39;s not a surprise to me.",1,0.909090909,0.909090909,0.882988539
67,0.522990644,Facebook fact checker. You share post of other peoples and  Facebook block us with up to 3 months without be able to share nothing .,0,0.895522388,0,0.869809605
68,0.521866262,"Facebook doesnt care about your security. I can report obviously fake profiles posting scam links & or malware, and every time they decided not to take the profile down.  The company consistently puts users and their information security at risk by their poor business practices and standards.",1,0.897058824,0.897058824,0.870210329
69,0.521147013,"The leak of privacy. FB is the worst social media alongside instagram viber and whatsup where you privacy is definitely ruined The only reason Ive been keeping this peace of Zuckerberg is, that Im waiting for something replacement of one from Apple.",1,0.898550725,0.898550725,0.870621059
70,0.520141602,Fraud. Facebook has always been fake and a big fraud nothing is private so be careful what you post on it,1,0.9,0.9,0.871040759
71,0.519997716,"Facebook App uses up Way Too much memory. Facebook platform/app is thumbs up as far as a social app , but I completely DISAGREE WITH FACT CHECKING It definitely VIOLATES MY FREEDOM OF SPEECH AND MY PRIVACYJoining Facebook Im offered choice if I want my account to be PUBLIC or PRIVATE AND FACEBOOK OFFERS CHOICES/OPTIONS FOR THE POSTS THE USER MAKES EITHER PUBLIC OR PRIVATE Now LETS GO BACK TO THE INITIAL CHOICE OF MAKING YOUR FACEBOOK ACCOUNT PUBLIC OR PRIVATE:1. My ACCOUNT IS PRIVATE 2.MY FRIENDS LIST IS PRIVATE 3.ANYTHING I POST IS PRIVATE AND ONLY MY FRIENDS AND FAMILY CAN VIEW MY POSTS , COMMENTS, AND PICTURES UNLESS I CHOOSE TO MAKE ANY OF IT PUBLIC.So if my account is not viewable in any way besides a profile picture, WHY ARE STRANGERS CALLED FACT CHECKERS ACCESSING MY PRIVATE PERSONAL INFORMATION AND DECIDING WHATS ACCEPTABLE AND WHATS NOT? IT COMPLETELY WRONG AND VIOLATES MY CONSTITUTIONAL RIGHTS TO FREEDOM OR SPEECH AND MY PRIVACY and along with a whole list of many other issues I will not post.. ( LETS NOT MENTION SCAMMERS AND CYBER CRIMINALS SPOOFING AND SCAMMING PEOPLE AND MAKING FACEBOOK ACCOUNT WITH YOUR NAME AND PICTUREIt was great in the beginning but now , personally feel violated in many ways.. what a shame..RUMBLE RUMBLE RUMBLE",1,0.901408451,0.901408451,0.871468473
72,0.519508362,"Spreads disinformation. Facebook knowingly allows the spread of dangerous disinformation. They do not remove posts that violate their policies, and they dont remove posts that are detrimental to society, the environment, and democracy.",0,0.888888889,0,0.859364744
