id,socre,doc,result,Precision,,AP
73,0.516746998,"Big Brother is always watching you. Everything you do on this platform, you are being watched. Your data is gathered to use against you. Facebook, Meta, whatever you want to call it, passes major privacy laws. Do what you will with that information.",1,0.890410959,0.890410959,0.859790034
74,0.516372859,Beware of Being censored. Anything that you might share regardless off being true or not Facebook will censor if they find it not to be true. Keep doing it &amp; you will be thrown out of Facebook.,0,0.878378378,0,0.84817125
75,0.515633106,Thieves. Facebook is just inherently an immoral company and congealment of people. Zuccerberg has a god complex and his private property and wealth should be expropriated and Facebook nationalized as communications infrastructure,0,0.866666667,0,0.8368623
76,0.515576661,Facebook censors. Facebook has independent fact checkers paid for by Facebook. Doesnt sound very independent if you ask me. To the point that they will even fact check actual videos that we see with our own eyes and what we are seeing and why its not true. I am moving to Parler where everyone can post without Facebook censoring everyone. I have officially left Facebook.,0,0.855263158,0,0.825850954
77,0.514287949,"Standards. Facebook is trash, dont let them harvest your personal information like that.",1,0.857142857,0.857142857,0.826257342
78,0.513527274,"Your privacy is being assault by Facebook. Dont trust further this app and company :Facebook, Instagram and WhatsApp. They sneak into your privacy data and sale it and make all kinds of profit from it.",1,0.858974359,0.858974359,0.826676791
79,0.512687325,nazi lovers. facebook protects nazis and sells all of your private information,1,0.860759494,0.860759494,0.827108218
80,0.511731088,"I dont understand. Besides basically our full life, as you already have to AOL, xanga, MySpace. This app is ideal for Facebook interactions. You have full control of what you getNotified for all privacy settings etc. formed with meta-there are more things that you can do and control ultimately you pay a price to have full control but I dont understand the issue knowing that youre On social media a public domain. Facebook is great on browser and app and I prefer the app because of the updates I prefer the browser because of the old formation that is still available that very much helps with networking. Give it a chance",0,0.85,0,0.816769365
81,0.510094941,High tech industries spay on you because of Facebook. Facebook is bad it let the highTech company to access personal information. Its supper stupidity,1,0.851851852,0.851851852,0.817202482
82,0.50978446,"Disappointing. Im giving fb two stars because for awhile I have noticed people I am not associated with have pictures of my daughter on their Facebook. My daughter is only 4 years old. For what ever reason I cannot find where to make my profile completely private. The only things I can see that are private are my about me info and what ever I post/share. My featured photos cant be made private and it really irritates me that fb changed the privacy settings making it impossible for our profiles to be 100% private and inaccessible from people we dont know and arent friends with. Fb used to have better privacy settings that way when you set your profile to private absolutely no one youre not friends with can see your pictures or about me info. The more time passes and the more problems that pop up it makes me think the Facebook company as a whole does not care about its users right to complete privacy from random unknown people on the internet. I mean theres a setting to keep people from looking you up from a search engine hows that actually useful? Its useful in one aspect thats it. Id really like to be able to completely block out anyone I dont know without having to block everyone of those people, thats just time consuming.",1,0.853658537,0.853658537,0.817647068
83,0.50878042,"Facebook is garbage. You are the product, not the customer.",0,0.843373494,0,0.807795899
84,0.508404732,"Facts. Facebook does not like you telling the truth, facts dont matter to them If its untrue its a fact for Facebook Its being run by idiots, who get butt hurt over the littlest thing My two-year-old grandchild is more adult than the people running Facebook",0,0.833333333,0,0.798179281
85,0.508342981,"Major privacy concerns. Besides the annoying repetitive ads, major major major privacy invasion Why would you want Fb to see your offline activity? Sounds psychotic to me They can see everything outside the usage of app such as all private conversations, calls, bank apps, etc. It is a NO for me, mind boggling to say the least.",1,0.835294118,0.835294118,0.798615926
86,0.508115649,Review of Facebook. Their censorship and marketing of your personal information is highly unethical,1,0.837209302,0.837209302,0.799064686
87,0.50728786,"Facebook is a Cesspool. Cesspool of lies, politics, fake news, threats, sex and pornography, illegal immigration business and people fighting over their own 2 cents, political views and personal feelings. This social media can be used for so many illegal activities. I once reported an account of my friend that was made a copy and have been requesting us to accept her friend request and been asking for money but she said its not actually her and its been using all her details from name to photos. So what we did was report it to Facebook and the Goddamn reply was this dis not go against Facebook policy That blew me off",1,0.83908046,0.83908046,0.799524638
88,0.50660646,Its Facebook. They want to sell your personal data and ruin your life.,1,0.840909091,0.840909091,0.799994916
89,0.506480455,Boycott Facebook. Download if you want your personal data sold and shared with 3rd parties,1,0.842696629,0.842696629,0.80047471
90,0.506433487,Lets start with. The fact that facebook released data showing personal information to undisclosed persons. They have been hacked and Ive been shadow banned for sharing my opinions. I can not get on IG (owned by Facebook) and go live because Ive been banned. I cant add anything on marketplace across platforms for some reasons. Facebook is now being exposed in the news for hurting the minds of children and mowing about it and still putting profits over anything else. Disgusting app by small hat CEO.,1,0.844444444,0.844444444,0.800963263
91,0.506230533,Shame on FB. Facebook is not a place where you can express your views freely.  You can express what FB fact checkers deem facts.  They control what you see and hear.  It is a dangerous threat to our democracy to have this social media platform able to mold our perception of the world.   All social media platforms need oversight by a third party to ensure freedom of speech.  Bad,0,0.835164835,0,0.792161469
92,0.506120861,"Commie propaganda. Facebook has fallen victim to the commie propaganda. They fact check things, without any facts behind it. Hide the truth from the people. Cover for politicians when they mess up. And spread lies they try to push off as facts. You should all be ashamed of yourselves.",0,0.826086957,0,0.783551018
93,0.50184077,Facebook/Meta. This FB was designed to spy on people.  It has evil roots and everyones info is being gathered to further do damage to our world,1,0.827956989,0.827956989,0.784028502
94,0.500775933,Privacy Nightmare. Facebook wants way too much control over my phone and tracks a disturbing amount of data for what should essentially be just a web browser. Super creepy.,1,0.829787234,0.829787234,0.784515297
95,0.500674963,"Facebook the worst social media app. This app or better, this company more and more wants to spy on us, last to have access to our documents. Pat in the end to sell them, more and more they want to control their clients according to how they want to protect our information, everything is a lie.",1,0.831578947,0.831578947,0.785010703
96,0.498740882,Snoops on private data. Sick of things I text about or talk about showing up in ads on Facebook. I have tracking turned off.  Sick of the creepiness. Isnt it illegal to steal this data?,1,0.833333333,0.833333333,0.785514064
97,0.498027384,Facebook is liberal garbage. They sell your private information. Dont download this crap.,1,0.835051546,0.835051546,0.78602476
98,0.497738957,Liability. Facebook censored information about the origin of Covid and actually banned users for speaking the truth.I would give Facebook zero stars if I could.,0,0.826530612,0,0.778004099
99,0.495972365,Promotes Human Trafficking and other inappropriate behavior. This company believes they possess the virtual right to promote disgusting behavior. Facebook needs to either fix its privacy issues or get KICKED OFF THE APP STORE.,1,0.828282828,0.828282828,0.778511965
100,0.495391279,"Facebook intelligence. Facebook is using my camera, keyboard, restricting and modifying any information or news I receive. Its pretty funny how the number one social media app in the world is a tool to actually limit our human constitutional rights. People need to wake up.",1,0.83,0.83,0.779026845
101,0.493686438,DONT USE THIS APP. Not only will they censor what you believe in. Facebook sells your information which can lead to fraud calls or even death threats,1,0.831683168,0.831683168,0.779548195
102,0.492033601,"Private accounts. Although I dont use Facebook that often, I seriously do not understand why it is so difficult to private your account. Its like they dont want you to have privacy? Going into every tab and every little crevice of this app just to be able to private my account and I seriously cant find it. So annoying, wish it was easier.",1,0.833333333,0.833333333,0.7800755
103,0.491473466,"Tyrannical. Facebook is a left wing, free speech hating platform that censors the truth. They also sell your personal information.",1,0.834951456,0.834951456,0.780608277
104,0.491302162,Facebook is a scam. If youve watched the Facebook whistle blower video youll know that Facebook steals and sells your information. Facebook also is responsible for mass genocide and dividing our nation. F Facebook lol get zucced,1,0.836538462,0.836538462,0.781146067
105,0.490184635,Facebook is the real problem. Facebook is a scam. It can be blamed for all the problems facing society today with the number one issue being miss information. If you work for Facebook please find a new job and stop actively contributing to the problem.,0,0.828571429,0,0.77370658
106,0.488837272,"Social Media. Facebook is trash, your life will infinitely be better once you remove it from your mobile device.",0,0.820754717,0,0.766407462
107,0.48859638,"Censors information, claims to know all truth under the sun. Sick and tired of Facebook censoring posts with valuable information that the public ought to know.  Facebook censors truthful information while boosting falsehoods.",0,0.813084112,0,0.759244775
108,0.488553971,no privacy . no privacy for what do you need from,1,0.814814815,0.814814815,0.759759313
109,0.486475736,Need to fine another place. Facebook is not safe for privacy,1,0.816513761,0.816513761,0.760279996
110,0.48644501,Too much censorship. Who is Facebook to decide what is truthful information or not?  Sounds like censorship to me. Dont appreciate the fact that peoples First Amendment rights are being violated. This used to be a free country. Im not sure what we are now.,0,0.809090909,0,0.753368359
111,0.484595358,Facebook is a scam. They dont stand by their privacy and security at all. My profile got hacked that I had for 12 years and I reported it at least 30 times and every one of my friends on Facebook reported it. And Facebook did nothing about it. Never deleted the page or anything and I had a lot of personal information that the hacker used trying to spam others that where friends with me on Facebook.,1,0.810810811,0.810810811,0.753885859
112,0.4838503,"Facebook has 0 support and steals your information. I tried to make a Facebook account and it said my birth name wasnt real, so when I tried to click on the support option it tried to make me give them a picture of my ID with fine print saying theyll keep my ID in their database. There is no way around this because Facebook has 0 contact methods including phone calls, live chat or even email. Pathetic",1,0.8125,0.8125,0.754409199
113,0.483706117,"Write to your legislators. Privacy is important. Today Facebook has monopolized the social media applications in order to promote consumerism by selling our data. However, Facebook refuses to incorporate measures to protect people from human and child trafficking, drugs, cults, and racism. There needs to be laws on the books to hold those at Facebook accountable as they are the middle man. Finally, where are we going with this platform which reeks of entitlement? When you think about how corporations donate to political campaigns and what this platform has done to ruin presidential elections such as the one won by Trump- I say deactivate my account. I would rather talk to my real friends in person. Pick up a phone- reach out and touch someone. Personally, I would prefer it to a GIF or a like.",1,0.814159292,0.814159292,0.754937961
114,0.482537776,"Stalkers. I dont like the data linked to me you are tracking and selling to others. Deleted Facebook, Messenger, Instagram and WhatsApp. Will keep using more decent apps like Signal and Twitter. At least they dont spread conspiracy theories and misinformation like Facebook does.",1,0.815789474,0.815789474,0.755471747
115,0.481696427,"Get your family off the app. Their information is being stolen because they dont understand how selling information works. Try to get your family, especially elders and children to stop using the app, so much private information gets shared through Facebook because they believe they are posting privately when most of the time they very much arent.",1,0.817391304,0.817391304,0.756010177
116,0.481229216,Sensorship. Facebook deactivated my account because I said this Imagine spying on the trump campaign then lying to the American people about it.,0,0.810344828,0,0.749492848
117,0.480595648,"Facts. Facts dont matter to Facebook, their facts are in a alternate world I knew they were messing up back in the 80s when they closed all the mental institutions, more than half the people on Facebook need to be in a mental institution Facebook allows the employees to stalk people I have one Im waiting on a attorney to call me back",0,0.803418803,0,0.743086927
118,0.480069727,"Im deleting Facebook. Facebook has become way too invasive, and sells your personal information. Delete this crap basket while you can. I am.",1,0.805084746,0.805084746,0.743612332
119,0.479249626,"Customer support. I enjoy Facebook. But the customer support is crap. Then ensuring your safety and privacy is a lie. I had my Facebook hacked and so have a bunch of other people. There is no way to directly contact someone and even though several people have reported my Facebook as hacked they still have not done anything about it. The guy who hacked my Facebook is conversating, laughing, and messing with my friends and family including my kid. Thinking this who thing is a joke. I have personal information on my Facebook and they are not protecting my privacy. I am scared for my safety and the information he most liky accessed including my home address. They need to figure out a better system and take care of issues like this immediately. They want to kick people off for petty issues but will not help resolve important issues. Facebook is a good way for keeping in touch with family and friends but they do not ensure your safety or privacy like they say they do.",1,0.806722689,0.806722689,0.744142671
120,0.478317201,Its not about The People. Facebook is stripped you of your freedom of speech thought and individuality they sell your information its all about screwing the people we are nothing but a $ .. Im a 90 day Facebook prisoner veteran for being funny if youre sensitive and dont like one person is talking about or saying youre joking Ill get the f%$@# off my page simple . But no you need to create a profile but its not yours its Facebooks within a minute to you since are you and sell u . Negative the big bang and thats what I read this please,1,0.808333333,0.808333333,0.744677593
121,0.477965444,"Data Mining. Facebook mines your datas and sells it to Cambridge Analytica to use for targeted advertisements and more. Anything you put on there is up for grabs. Be careful. Ive deactivated for a few now and suggest all of you to do the same. They now change their name to Meta to try to leave their sketchy past behind them, but dont be fooled, they are not changing their practice at all. It just goes down hill from here. Be Warned.",1,0.809917355,0.809917355,0.745216765
122,0.477584839,Facebook SPIES ON USERS. This app used to spy on you and everyone you know.,1,0.81147541,0.81147541,0.745759868
123,0.477210224,No privacy. I do not trust this social media site.,1,0.81300813,0.81300813,0.746306602
124,0.475969464,Not forthcoming on the apps privacy risks. Facebook is supporting human trafficking. We have been trying to locate my sister that has been trafficked through Facebook overseas. Facebook has been non compliant with authorities in our investigation. Facebook is a criminal enterprise.,1,0.814516129,0.814516129,0.746856679
125,0.475143701,Restrictions. Facebook restricts you for what other people say to you honestly needs new people running it,0,0.808,0,0.740881826
126,0.47325179,"SELLS YOUR PERSONAL INFORMATION TO EXTORTIONIST. SELLS YOUR PERSONAL INFORMATION TO EXTORTIONIST. NO MORE SOCIAL MEDIA FOR ME, THAT INCLUDED WHATSAPP AND INSTAGRAM.",1,0.80952381,0.80952381,0.741426603
127,0.47306028,privacy. Its have zero privacy,1,0.811023622,0.811023622,0.741974611
128,0.472956747,"Censorship at its worst. This app censors anything Facebook disagrees with.The app listens to your conversations and then feeds you ads based in what you were talking about.It doesnt show your posts to all of your friends, only a few you interact with most.Its basically useless and now a real community.",1,0.8125,0.8125,0.742525591
129,0.472119957,"Censoring everything. A terrible app. I used to be able to share valuable information, now Facebook thinks everything is threat so I can no longer share journalism from people Facebook disagrees with. Horrible.",0,0.80620155,0,0.736769579
130,0.471643388,"Photos. Our photos should be private not for everyone to see. And freedom of speech shouldnt be censored. We have a right to speak our minds. If what people post isnt true then you/Facebook shouldnt allow it. And if it is then you shouldnt have fact checkers marking it as false. Sad world we live in when social media, isnt social media no more.",1,0.807692308,0.807692308,0.737315138
131,0.471505523,Read. Facebook used to be great and simple of course there would be a few bugs and things but it wasnt bad the algorithm has gone awful you cant make things private anymore you used to be able to keep your personal things personal and not just entirely public even though it is a public app there should be better limitations especially for peoples family you should have better options for what you can and cannot do you used to have a choice now its either put everything out there or nothing at all i myself have used it for years its sad to see it go so far downhill and many other people have said so and its still going unnoticed facebook do better if your going to download it you should know the risks upfront,1,0.809160305,0.809160305,0.737863574
132,0.469973654,"They dont value Truth. The fact is Facebook has become something I dont think it was ever intended to become, the app is trash, tons of technical issues and these people swear they are rulers of all freedoms. Its okay though because before they know it their perception of themselves will become what truly is, and thats nothing but a freaking social media app. Check your ratings here it speaks for itself.",0,0.803030303,0,0.732273699
133,0.464628071,Facebook is trash. Facebook lies Facebook sells your data Facebook manipulates people by show them false information that fits there agenda but when you actually give out real facts and real studys they ban you for false information or dangerous individuals all facebook does is brainwash the masses and take away our rights. Facebook thinks they are so powerful they can do whatever they want like take away your first amendment rights of freedom of speech because it doesnt fit the narrative Facebook doesnt let you participate in the second amendment you try to show anything related to the second amendment and your banned for violence. Facebook is a evil communist controlled ap used  to takeaway our rights alone with Instagram and Twitter none of them allow the truth to be told all of them want world control,1,0.804511278,0.804511278,0.732816839
134,0.464598119,No privacy. My page has been hacked twice Thad it thats all done with Facebook its a scam,1,0.805970149,0.805970149,0.733362759
135,0.46392256,"HAD TO COME BACK AND GIVE ANOTHER 1 star REVIEW. Facebook use to be a place where you can be yourself, express yourself, and have fun on a ENTERTAINMENT APP. Facebook not even for entertainment anymore. They take everything extremely too serious. You cant quote anybody especially if they say something thats out of the regulations of Facebook. Facebook use to be a app I use to come to for entertainment and JUDGEMENT FREE zone. Now I dont even feel safe with posting. If you re share a post that was false information but you didnt know, they put your account in warning or restricted status. SINCE WHEN DID FACEBOOK BECOME SO SENSITIVE????",0,0.8,0,0.727930442
136,0.46192497,"Ok but it wants to know my personal informations. This app wanted to know what my personal informations are. I only used it to find my family (my Moms side families), but someone is trying to bully my family and me. I wanted her (Heidi) to be removed off from FB, so my family and I would be safer.",1,0.801470588,0.801470588,0.728471178
137,0.460787475,"Negative 5 stars  WARNING. Stay away from this app and messenger.Do you think messenger is private?Think again, Facebook monitors all conversations.If they have your credit card information, they will sell it.They look at your private photos.Nothing is private.This is a corrupt company that should be shut down.DO NOT GET THIS APP or ANYTHING ELSE that has any affiliation with FACEBOOK.",1,0.802919708,0.802919708,0.729014598
138,0.460763365,Censorship & Propaganda. If your opinion doesnt fit facebooks narrative theyll get involved. Not really social for social media.,0,0.797101449,0,0.723731884
139,0.459064126,Should be called spy book. All they do is spy on you selling your information to other companies. As soon as you look something up you start seeing advertisements on Facebook immediately for what you just looked up. If you disagree with anything they say they claim you go against community standards and put you in jail. But they dont absolutely describe what the community standards are as they change minute by minute.,1,0.798561151,0.798561151,0.724270224
140,0.458631277,Facebook Protects Stalkers. I feel like either Facebook needs to take away the option of seeing other people watch your profile stories or show you whos watching your profile stories because at this point I have consistent viewers that say others watched your story its worrisome because who are these ppl and why do they watch all of my posts ??? Facebook aides stalkers in stalking,1,0.8,0.8,0.724811151
141,0.458174378,"Lack of Security. Facebook was very quick in notifying that someone else tried to access my account. However, when I tried to report about the issue, nothing happened. Theres no customer service to make sure they are increasing security and privacy.",1,0.80141844,0.80141844,0.725354465
142,0.457593381,Horrible when requesting help. My account was hacked and all the options they gave was no help. Once people change your profile information there is nothing Facebook does. Ive never seen a company have no tech help you can call foe assistance. If there is a phone number it is not easy to find. I will limit my Facebook use to next to nothing outside of a Facebook live video that is done. But outside of that I will not recommend fb to anyone and will warn everyone I know.,1,0.802816901,0.802816901,0.725899975
143,0.455106288,"Cesspool of Lies and Fake news. Cesspool of lies, politics, fake news, threats, sex and pornography, illegal immigration business and people fighting over their own 2 cents, political views and personal feelings. This social media can be used for so many illegal activities. I once reported an account of my friend that was made a copy and have been requesting us to accept her friend request and been asking for money but she said its not actually her and its been using all her details from name to photos. So what we did was report it to Facebook and the Goddamn reply was this dis not go against Facebook policy That blew me off",1,0.804195804,0.804195804,0.726447498
144,0.454595715,Privacy. The reason for this is because Ive seen myself on peoples pages that I dont even know And I cant make my account private,1,0.805555556,0.805555556,0.72699686
145,0.453694791,"The Truth. All that Facebook cares about is money and not the safety of us and the Facebook community. Mark Zuckerberg, bull$%+ all you want. You know the truth and what youve done, but you cant confess or address the problem. Why? Because YOU are the problem If Facebook must be shutdown, so be it. Shame on you Mark, youre the worst CEO of this social media platform You just got exposed from a whistleblower",0,0.8,0,0.721983088
