id,socre,doc,result,Precision,,AP
188,0.461702704,"Help me out. Facebook, you can change the culture, facilitate revolutions in foreign countries, influence US elections, and be the sole arbitrator for what content can be seen on your communication tool that is used by millions around the globe, but you cant help me to regain access to my FB account that has been hijacked by someone using a hotmail account despite my following all of your protocols.",1,0.728723404,0.728723404,0.614152845
189,0.459273964,Invasion of privacy. Too much personal information being exploited,1,0.73015873,0.73015873,0.614766632
190,0.45688206,Privacy on posts. I do not understand why my privacy option in settings on who sees my posts was taken away. I should not have to go into each post and manually change the audience. I now see why Meta is under investigation. Yet you claim to be so secure for people. Obviously that was a lie.,1,0.731578947,0.731578947,0.615381434
191,0.450606436,Evil to the core. Facebook is trying to delete all their skeletons in the closet right now. servers down hours after Frances Haugen blew the whistle. We may never know the full extent of how bad it actually got over there. May these privacy invading pioneers of misinformation and censorship get what is coming to them at long last.,1,0.732984293,0.732984293,0.615997156
192,0.445001662,"Nothing but Ads. I have a lot of friends and it takes me awhile to update myself on the news feed. The problem is, for every one of my friends post, there's and Ad, and I have been hiding them and they come back. This app should be called Adbook. There's no social media here.",0,0.729166667,0,0.612788837
193,0.440640301,Breach of privacy. This app makes me feel like my information isnt safe. Like looking through my DMs or something.,1,0.730569948,0.730569948,0.613399102
194,0.43621403,no privacy . no privacy for what do you need from,1,0.731958763,0.731958763,0.614010234
195,0.43547973,Privacy and censorship. Meta has turned into a place with no privacy and no freedom to think for yourself.. it is not a safe place. Your personal information gets shared for their profits. No thank you. I will find another app.,1,0.733333333,0.733333333,0.614622148
196,0.432518125,Facebook from George Orwell. This site is politically biased and will censor anyone with a opinion that varies from the globalist agenda they will allow you to be threatened insulted and allow your image and info to be taken and used against you there is little or no customer support and they encourage harmful content as long as it pushes their views,0,0.729591837,0,0.61148632
197,0.426212668,"Dictature. This Facebook with media control is just like a dictator, I m thinking that I can find my way on informations without this fake news Covid",0,0.725888325,0,0.608382329
198,0.416384906,No privacy. Also they dont watch the content close enoughLots of inappropriate content that is not taking down even if reported,1,0.727272727,0.727272727,0.608982785
199,0.412686318,"no newsfeed. i haven't been able to see my newsfeeds for more than 3 months. i have reported it every day & there's no record of my reports. i have tried app & desktop. nothing. updated my app. nothing. i even tried uninstalling & reinstalling. nothing. if i can't see my friends updates, what's the point?  what kind of social media is fb if you can't be social with ANYONE? ready to move on to a different source of social media.",0,0.72361809,0,0.60592257
200,0.388432294,"They need to protects the users more. Yeah the amount of scammers and hackers on there is unreal, and I recently lost my Facebook to a hacker and now I just have no idea how to get it back or make a new one I cant find a phone number everything seems overly complicated to try and get help especially when you just lost all your info to a random person that decided they want your acount just to delete it or to harass the people I know puts a bad image on my name",1,0.725,0.725,0.606517958
