id,socre,doc,result,Precision,,AP
64,0.591359675,"Facts. Facts dont matter to Facebook, their facts are in a alternate world I knew they were messing up back in the 80s when they closed all the mental institutions, more than half the people on Facebook need to be in a mental institution Facebook allows the employees to stalk people I have one Im waiting on a attorney to call me back",0,0.859375,0,0.782322577
65,0.591272175,Snoops on private data. Sick of things I text about or talk about showing up in ads on Facebook. I have tracking turned off.  Sick of the creepiness. Isnt it illegal to steal this data?,1,0.861538462,0.861538462,0.783541282
66,0.590767384,"Spyware. Facebook app is spyware. Just read the privacy section of the app store description for this app, and see for yourself how much this app collects information about and from you.",1,0.863636364,0.863636364,0.784754844
67,0.590494454,Review of Facebook. Their censorship and marketing of your personal information is highly unethical,1,0.865671642,0.865671642,0.785962558
68,0.590256691,Tech support and selling your information. Tech support is horrible not to mention they allow companies to use your information. Facebook is evil on many levels but screening and filtering to their benefit is #1 priority.,1,0.867647059,0.867647059,0.7871638
69,0.590118229,"No privacy, no rights. Facebook is a very invasive app into you privacy, it snoops into your online shopping and then bombardes you with ads. There is no freedom of speech and there is not a group for everyone, if Facebook doesnt like your thing they ban it. You have zero rights with this terrible company. DO NOT JOIN",1,0.869565217,0.869565217,0.788358024
70,0.590092242,"Your privacy is being assault by Facebook. Dont trust further this app and company :Facebook, Instagram and WhatsApp. They sneak into your privacy data and sale it and make all kinds of profit from it.",1,0.871428571,0.871428571,0.789544746
71,0.589202523,Tracking and Stalking. They track everything. Its like having a personal stalker. Why do they need so much info on us? Will not continue with FB. I hope FB dies and Suckerburger loses all his money.,1,0.873239437,0.873239437,0.790723544
72,0.58813864,"Censors information, claims to know all truth under the sun. Sick and tired of Facebook censoring posts with valuable information that the public ought to know.  Facebook censors truthful information while boosting falsehoods.",0,0.861111111,0,0.779741273
73,0.587593138,"Bad for you. Bad for everybody. Just ask yourself: how does a company which trades in your personal, private business make so much money? Heck, just do a search and see. Social media has been bad for children, adults, entire continents. Its not hyperbolic, when you think of the number of folks using this service. And Facebook (Meta good luck with that rebranding PR), of all social media, has been the absolute worst. Users should have figured that out when Zuck laughed about people being stupid, handing over personal, private information. We left FB in 2009 (about the time they claimed copyright over every photo, video, thought, posted) and have looked on from the sidelines as the world just kinda forgot? how to be civil?  And now FB is just a great place to about into a loud echo chamber with only like-minded. Real growth there, folks. Super job shepherding humanity into the 21st century.  Do yourselves a favor: quit. Free is never free. And Facebook is just plain bad for people. It is. (Also, if our personal information is worth so much, why cant we see it? Why arent we allowed to review it? Lastly, why cant we sell it ourselves? Letting some third party in your home to steal your privacy is just stupid.)",1,0.863013699,0.863013699,0.780881991
74,0.586426854,Privacy is Nonexistent. I am hoping to see Facebook broken up.,1,0.864864865,0.864864865,0.782016895
75,0.585487366,"Facebook App uses up Way Too much memory. Facebook platform/app is thumbs up as far as a social app , but I completely DISAGREE WITH FACT CHECKING It definitely VIOLATES MY FREEDOM OF SPEECH AND MY PRIVACYJoining Facebook Im offered choice if I want my account to be PUBLIC or PRIVATE AND FACEBOOK OFFERS CHOICES/OPTIONS FOR THE POSTS THE USER MAKES EITHER PUBLIC OR PRIVATE Now LETS GO BACK TO THE INITIAL CHOICE OF MAKING YOUR FACEBOOK ACCOUNT PUBLIC OR PRIVATE:1. My ACCOUNT IS PRIVATE 2.MY FRIENDS LIST IS PRIVATE 3.ANYTHING I POST IS PRIVATE AND ONLY MY FRIENDS AND FAMILY CAN VIEW MY POSTS , COMMENTS, AND PICTURES UNLESS I CHOOSE TO MAKE ANY OF IT PUBLIC.So if my account is not viewable in any way besides a profile picture, WHY ARE STRANGERS CALLED FACT CHECKERS ACCESSING MY PRIVATE PERSONAL INFORMATION AND DECIDING WHATS ACCEPTABLE AND WHATS NOT? IT COMPLETELY WRONG AND VIOLATES MY CONSTITUTIONAL RIGHTS TO FREEDOM OR SPEECH AND MY PRIVACY and along with a whole list of many other issues I will not post.. ( LETS NOT MENTION SCAMMERS AND CYBER CRIMINALS SPOOFING AND SCAMMING PEOPLE AND MAKING FACEBOOK ACCOUNT WITH YOUR NAME AND PICTUREIt was great in the beginning but now , personally feel violated in many ways.. what a shame..RUMBLE RUMBLE RUMBLE",1,0.866666667,0.866666667,0.783145558
76,0.582148015,"Its all about collecting personal data. I just created a profile after months. I deleted my old account as I felt fb was into my life too much. Plus most of the suggestions were very segregated as I only had access to people who look like me despite the diversity in my personal life. I had my old account since 2015. Anyways, I created a profile just 20 minutes ago. I put a facebook cover up of my business like Ive always done in the past. Didnt put a profile pic up yet as I wanted to put one up that was really liked. I modified some settings and decided Ill come back after a break to finish. Facebook sent me an e-mail 5 minutes after signing out saying my account was disabled for breaking community guidelines. There are so many ways to connect with people in the world without this platform. If I immediately posted all of my personal information I guarantee my profile would still be up and running. These big sell out companies show their true colors every time. I dont take this personal and happy facebook did me a favor.",1,0.868421053,0.868421053,0.784267604
77,0.581735611,Facebook. Facebook sells your information. Its not a trusted site. Really should dismantled.,1,0.87012987,0.87012987,0.785382699
78,0.581690013,"Write to your legislators. Privacy is important. Today Facebook has monopolized the social media applications in order to promote consumerism by selling our data. However, Facebook refuses to incorporate measures to protect people from human and child trafficking, drugs, cults, and racism. There needs to be laws on the books to hold those at Facebook accountable as they are the middle man. Finally, where are we going with this platform which reeks of entitlement? When you think about how corporations donate to political campaigns and what this platform has done to ruin presidential elections such as the one won by Trump- I say deactivate my account. I would rather talk to my real friends in person. Pick up a phone- reach out and touch someone. Personally, I would prefer it to a GIF or a like.",1,0.871794872,0.871794872,0.786490547
79,0.58153367,Lets start with. The fact that facebook released data showing personal information to undisclosed persons. They have been hacked and Ive been shadow banned for sharing my opinions. I can not get on IG (owned by Facebook) and go live because Ive been banned. I cant add anything on marketplace across platforms for some reasons. Facebook is now being exposed in the news for hurting the minds of children and mowing about it and still putting profits over anything else. Disgusting app by small hat CEO.,1,0.873417722,0.873417722,0.787590891
80,0.580590725,"Completely Policed and Suffocates Freedom of Speech. The only benefit Facebook still has is connecting with friends and family I know closely. Other than that, they use their algorithms to tag normal factual things you post or say regarding current topics as false or requiring fact checking if they are contrary to Facebooks agenda. The few good things it provides are severely outweighed by all the toxic fear-mongering topics that are shared in accordance with Facebooks agenda. And good luck if you have facts or opinions that contradict this agenda youll be labeled as a false information spreader. Facebook is doing nothing but stressing people out and causing them to become more polarized and divided than ever. Shame on you, Facebook",0,0.8625,0,0.777746005
81,0.580524683,"Really????. Really Facebook? Now your popping up a box to share a world wide news story to a closed private group. First I don\'t need to be told to share or not. I\'m old enough to decide that for myself. Secondly if I shared a news story to a private group that has nothing to do with that group, it would be deleted and I would be kicked out of the group. What a stupid stupid recommendation. Get with it.",0,0.851851852,0,0.768144202
82,0.57987088,"Invasive, Avoid at all costs. Bias party and concerning privacy breaches. UPDATE: So I had this one individual contact me condescendingly about how much he doesnt like the price at which Im selling something at marketplace and then reports me, facebook without gathering any data terminates my account. Facebook has grown to be a disease to our nation and individuality. Privacy is not respected whatsoever, the most invasive site on the web next to google.Avoid facebook. Its only value was the marketplace and the ability to save game data. The measures they take to collect your information is concerning.",1,0.853658537,0.853658537,0.76918706
83,0.57933569,Facebook. rose: The App says enjoy your friends and community privately thats a flat out lie Facebook used to be great but now it is used by the Government to spy on you and say what you can and cannot post you cant even make a joke anymore. All of the community standards people are foreigners and Obamas and Biden people since when did a Social media site that people communicate with their family and friends become a government controlled tool its appalling I really enjoyed Facebook to share with my out of town family I joined when it first came available they totally ruined it. I get scolded for everything I made a joke to my sister they banned me It has been taken over by the government and you cant post or say anything this should be against the law Then when you find another free site they take it down its sick They even spy on your messenger,0,0.843373494,0,0.759919746
84,0.579107106,Facebook is the real problem. Facebook is a scam. It can be blamed for all the problems facing society today with the number one issue being miss information. If you work for Facebook please find a new job and stop actively contributing to the problem.,0,0.833333333,0,0.750873083
85,0.578561544,"FCc. You are not allowed to track personal details on our accounts. I am reporting facebook and all the requests to review things that don't work.  I hide things and it doesn't work, disable doesn't work basically Facebook is old and nothing works goodbye FB done had to give a star or it wouldn't post. I would give negative 500000",1,0.835294118,0.835294118,0.751866271
86,0.578292668,Trash. Facebook is trash. They sensor your freedom of speech. F**k Facebook,0,0.825581395,0,0.74312364
87,0.578145921,"Facebook reality. Facebook has changed a lot now, they  try to control what you see and share, they restrict your account when they feel or want to without you making something bad, wish we could be free to share our thoughts like we used to do before.",0,0.816091954,0,0.734581989
88,0.577405095,Shame on FB. Facebook is not a place where you can express your views freely.  You can express what FB fact checkers deem facts.  They control what you see and hear.  It is a dangerous threat to our democracy to have this social media platform able to mold our perception of the world.   All social media platforms need oversight by a third party to ensure freedom of speech.  Bad,0,0.806818182,0,0.726234466
89,0.576655686,Too much censorship. Who is Facebook to decide what is truthful information or not?  Sounds like censorship to me. Dont appreciate the fact that peoples First Amendment rights are being violated. This used to be a free country. Im not sure what we are now.,0,0.797752809,0,0.718074529
90,0.5764575,American-patriot. Facebook is a criminal organization who will use our information to spy and find who we are so they can censor everything we say know all about us because of our pictures and everything we say,1,0.8,0.8,0.718984812
91,0.576258779,Dear Facebook. Stop selling my data and info pls,1,0.802197802,0.802197802,0.71989924
92,0.57622087,DANGEROUS SPYING WITHOUT USER PERMISSION. Pretty gross how Facebook was recently proven to collect plenty of user data without your permission and then use it against you,1,0.804347826,0.804347826,0.72081716
93,0.575586379,"The leak of privacy. FB is the worst social media alongside instagram viber and whatsup where you privacy is definitely ruined The only reason Ive been keeping this peace of Zuckerberg is, that Im waiting for something replacement of one from Apple.",1,0.806451613,0.806451613,0.72173796
94,0.571088016,"Photos. Our photos should be private not for everyone to see. And freedom of speech shouldnt be censored. We have a right to speak our minds. If what people post isnt true then you/Facebook shouldnt allow it. And if it is then you shouldnt have fact checkers marking it as false. Sad world we live in when social media, isnt social media no more.",1,0.808510638,0.808510638,0.722661074
95,0.570874274,"This is a problem. Why are other people allowed to share MY post/photo but I cant see it because of THEIR privacy settings? How does that make any sense when its my content to begin with? How do I know Im not being bashed or made fun of? If someone shares my stuff, I should be able to see it. Period. Bye.",1,0.810526316,0.810526316,0.723585971
96,0.570638478,Boycott Facebook. Download if you want your personal data sold and shared with 3rd parties,1,0.8125,0.8125,0.724512159
97,0.569682479,Facebook Protects Stalkers. I feel like either Facebook needs to take away the option of seeing other people watch your profile stories or show you whos watching your profile stories because at this point I have consistent viewers that say others watched your story its worrisome because who are these ppl and why do they watch all of my posts ??? Facebook aides stalkers in stalking,1,0.81443299,0.81443299,0.725439178
98,0.569493234,Facebook needs to do better. On facebook if you report something as bad as people leaking your address they dont care. They wont do anything about it.,0,0.806122449,0,0.718036737
99,0.566708028,"Standards. Facebook is trash, dont let them harvest your personal information like that.",1,0.808080808,0.808080808,0.718946273
100,0.565552354,"Disappointing. Im giving fb two stars because for awhile I have noticed people I am not associated with have pictures of my daughter on their Facebook. My daughter is only 4 years old. For what ever reason I cannot find where to make my profile completely private. The only things I can see that are private are my about me info and what ever I post/share. My featured photos cant be made private and it really irritates me that fb changed the privacy settings making it impossible for our profiles to be 100% private and inaccessible from people we dont know and arent friends with. Fb used to have better privacy settings that way when you set your profile to private absolutely no one youre not friends with can see your pictures or about me info. The more time passes and the more problems that pop up it makes me think the Facebook company as a whole does not care about its users right to complete privacy from random unknown people on the internet. I mean theres a setting to keep people from looking you up from a search engine hows that actually useful? Its useful in one aspect thats it. Id really like to be able to completely block out anyone I dont know without having to block everyone of those people, thats just time consuming.",1,0.81,0.81,0.71985681
101,0.563854933,"Tyrannical. Facebook is a left wing, free speech hating platform that censors the truth. They also sell your personal information.",1,0.811881188,0.811881188,0.720767943
102,0.562076032,Restrictions. Facebook restricts you for what other people say to you honestly needs new people running it,0,0.803921569,0,0.713701591
103,0.561911285,"Individuals believe that the database and privacy security features can be further improved. Facebook is praiseworthy of bringing convenience to the Internets social platforms, but at the same time there are also some areas that can further improve privacy and information security functions in social and media, and there are better defenses on data platforms.",1,0.805825243,0.805825243,0.714595995
104,0.560397208,"Customer support. I enjoy Facebook. But the customer support is crap. Then ensuring your safety and privacy is a lie. I had my Facebook hacked and so have a bunch of other people. There is no way to directly contact someone and even though several people have reported my Facebook as hacked they still have not done anything about it. The guy who hacked my Facebook is conversating, laughing, and messing with my friends and family including my kid. Thinking this who thing is a joke. I have personal information on my Facebook and they are not protecting my privacy. I am scared for my safety and the information he most liky accessed including my home address. They need to figure out a better system and take care of issues like this immediately. They want to kick people off for petty issues but will not help resolve important issues. Facebook is a good way for keeping in touch with family and friends but they do not ensure your safety or privacy like they say they do.",1,0.807692308,0.807692308,0.715491152
105,0.560008764,Need to fine another place. Facebook is not safe for privacy,1,0.80952381,0.80952381,0.716386701
106,0.559814036,Censorship & Propaganda. If your opinion doesnt fit facebooks narrative theyll get involved. Not really social for social media.,0,0.801886792,0,0.709628336
107,0.5591591,"Ok but it wants to know my personal informations. This app wanted to know what my personal informations are. I only used it to find my family (my Moms side families), but someone is trying to bully my family and me. I wanted her (Heidi) to be removed off from FB, so my family and I would be safer.",1,0.803738318,0.803738318,0.710507868
108,0.559130192,Privacy Nightmare. Facebook wants way too much control over my phone and tracks a disturbing amount of data for what should essentially be just a web browser. Super creepy.,1,0.805555556,0.805555556,0.711387939
109,0.559090614,"Lack of Security. Facebook was very quick in notifying that someone else tried to access my account. However, when I tried to report about the issue, nothing happened. Theres no customer service to make sure they are increasing security and privacy.",1,0.80733945,0.80733945,0.712268229
110,0.558110058,nazi lovers. facebook protects nazis and sells all of your private information,1,0.809090909,0.809090909,0.713148435
111,0.557921588,"Censorship at its worst. This app censors anything Facebook disagrees with.The app listens to your conversations and then feeds you ads based in what you were talking about.It doesnt show your posts to all of your friends, only a few you interact with most.Its basically useless and now a real community.",1,0.810810811,0.810810811,0.714028276
112,0.557657003,Facebook censors. Facebook has independent fact checkers paid for by Facebook. Doesnt sound very independent if you ask me. To the point that they will even fact check actual videos that we see with our own eyes and what we are seeing and why its not true. I am moving to Parler where everyone can post without Facebook censoring everyone. I have officially left Facebook.,0,0.803571429,0,0.707653024
113,0.556552887,Corrupt. Basically a way for women to sell their bodys. I tried reporting a 13 years olds explicit photos that were going viral and they report said it wasnt child pornography? Excuse me like what? Its a underage girl exposing her body for the world and Facebook doesnt find that inappropriate? People can find you using your phone number email or name and none of your info can ever just be kept private.  I had a women call my job one time and pretend to be me because Even tho my information and account is private you can still see where I work my birthday my email and my profile and cover art. They need to relearn the definition of privacy.,1,0.805309735,0.805309735,0.708517242
114,0.555751622,facebook is cancer to society. Years and years of user data collection and privacy issues on a platform that caters to instigation and division.,1,0.807017544,0.807017544,0.70938128
115,0.555585802,"Facebook is just awful now. *UPDATE* after going through the annoying ad section THAT YOU CANNOT TURN OFF I have hidden over 3 thousand ads...and guess what..literally every three posts..every three..there is an ad. And I am talking about very specific stuff Ive talked about in messages like texting and Facebook messenger. So what happened to them not datamining us? Sucker burger is nothing but a lying nazi who is stealing peoples information and selling it to advertisers First of all when Facebook dating came out I LOVED it, 100% better then any other site Ive used. But now me and 100s of others have been getting the error its not you, its us or try taking a break. I would come on after 1-2 days and click like on one person and instantly get that error. Ive uninstalled the app, updated the app, logged out and in, cleared the cache and still have it after a week. USELESS Second the people who run the app of looking at the reports are useless, there was a picture of a penis on my news feed and when I reported it I got a this doesnt go against community standards. People posting brand new pages that are completely fake, advertising they are a celebrity or doing a give away and to give their credit card info. Facebook allows people to be scammed and their support team will allow these pages to stay up and will not take the reporting seriously. Third which is the biggest...THE ADS Oh god there is at least 3 ads in everyones videos, literally every time you scroll down after 3 posts from friends there is a sponsor ad. There is NO option to hide all ads, no option to skim them down. They have a section where you can hide certain ads but guess what...the moment you do that it will replace that ad with another one. This site clearly still is using peoples private information, its allowing people to get scammed and its allowing people to make threats, post nudity and pick and choose what to ban. Actually my friends account got banned for saying god bless your family and he was banned for a week. I told him he should make a law suit against Facebook for religious sensory This app has went downhill more and more, something needs to be done about this crappy social network.",1,0.808695652,0.808695652,0.710244883
116,0.554192483,I just hate Facebook. Its about privacy. At this point Im using it because forced by coworker and my job.,1,0.810344828,0.810344828,0.711107814
117,0.554078281,"Easy Access, Uncensored, and Unprivate. I give one star to FACEBOOK, because any knowledgeable hacker can hack your profile on this website it is NOT PRIVATE it can be easily accessed of your account your PICTURES, your IDENTITY and any messages sent via MESSENGER can be accessible on FACEBOOK so if your looking for privacy my suggestion and advice dont seek SOCIAL MEDIA.",1,0.811965812,0.811965812,0.711969848
118,0.552829385,"Feed mess, privacy mess, profit first mess. The FB/Meta platform doesnt create goodwill towards the community.  Instead, privacy breakdowns and lack of transparency to its valued assets, people, are not followed.  This issue is across their entire product line.  They havent proven themselves as trustworthy and dont make themselves accountable internally.",1,0.813559322,0.813559322,0.712830776
119,0.551403403,Thieves. Facebook is just inherently an immoral company and congealment of people. Zuccerberg has a god complex and his private property and wealth should be expropriated and Facebook nationalized as communications infrastructure,0,0.806722689,0,0.706840601
120,0.55085206,"Private accounts. Although I dont use Facebook that often, I seriously do not understand why it is so difficult to private your account. Its like they dont want you to have privacy? Going into every tab and every little crevice of this app just to be able to private my account and I seriously cant find it. So annoying, wish it was easier.",1,0.808333333,0.808333333,0.707686374
