id,socre,doc,result,Precision,,AP
55,0.514288247,"Not for Privacy. Over and over and over Facebook has proven they care nothing about their customers. Privacy is not one of their concerns as they collect and sell everything you see, search, post and share. Ive been with them for since the beginning but Im done with them and their corrupt evil ways. Id rather pay for a secure app than sell my soul for this free app remember, nothing is free. As the app is becoming overrun with pedophilia, political censorship, elimination of personal thoughts and limiting everyones freedoms of speech I will just distance myself from these types of people and behaviors. God Bless America",1,0.945454545,0.945454545,0.892069077
56,0.513216734,Restricting/Banning. Facebook is restricting and banning accounts for sharing information from their own platform.  Regular users should not be attacked for sharing content that you allow on your platform.  The originator of the material should be the individual(s) in question.,0,0.928571429,0,0.876139272
57,0.511728466,"Invasive, pandering to insecurities, mining info for advertising galore. Impossible to remove your information from.  Already an unethical amount of data on my child housed here via others comments and pictures (Facebook has created a ghost profile of her already).  Clearly between this and Instagram its designed to be as addictive as possible.  Shame our youth are allowed to waste their times on it. Creating a generation of insecurities.  Facebook was found to intentionally pander to negativity for clicks and add revenue.",1,0.929824561,0.929824561,0.877081119
58,0.511311829,Facebook is not a good company. Gathering info on its client base and selling this information to the highest bidder is an evil practice. Facebook is a company that takes advantage of its users and attempts to manipulate public opinion and police thought. Screw these guys,1,0.931034483,0.931034483,0.87801135
59,0.510718167,"Im only giving Facebook one star and only to write this review. This is a Public service announcement and a review about Facebook the company better known as Facebook has flagged my email and has disabled my account for no reason at all. Example I went two whole weeks without using Facebook messenger or any associated app or website, I was dormant in using the app and as soon as I logged in I was logged back out automatically and notified I violated their community guidelines. Once I was put on notice I had the option to file a request for a  review of my account where I was then asked to upload a picture of my photo ID, so I managed to regain access to delete that account and created a new account under a different email and two days later was automatically signed out of my account  yet again and was notified that I was using multiple accounts and had to confirm the account I had deleted or permanently loose the account I had just made. I would not recommend this social platform for anybody because they track you using GEO location on your phone, monitor your microphone, and camera, and watch you 24/7  they require your physical address, phone number, and email, they require you to upload a photo ID or birth certificate. Meta previously known as Facebook is in association with 3rd party corporations in China where they take all data collected on you and sell it to big businesses and profit off your rights to use their services. They monitor each like, comment, and message made through Facebook app or messenger. It is not safe and idk why its even legal to use in the United States. As far as Im concerned Facebook is a CIA platform and is only free to the public to monitor and track each person online. They even monitor you when you arent using their app. As long as you have the app downloaded on your device regardless online or offline they still watch and monitor you, they track your microphone and your camera so Id be advised and delete the app, go to something else like MySpace, or something.",1,0.93220339,0.93220339,0.878929859
60,0.508998871,"They need to protects the users more. Yeah the amount of scammers and hackers on there is unreal, and I recently lost my Facebook to a hacker and now I just have no idea how to get it back or make a new one I cant find a phone number everything seems overly complicated to try and get help especially when you just lost all your info to a random person that decided they want your acount just to delete it or to harass the people I know puts a bad image on my name",1,0.933333333,0.933333333,0.879836583
61,0.508267581,"Propaganda From A Billion Dollar Corporation. I just want to see the people that I followed/liked/friended, and can tolerate ads, but facebook has now intrusively decided that I dont known anything about American History or Climate Change and that they need to quiz me on it in the middle of my feed. Who cares? This is a social media app, not a political or educational one. Finally going to delete my account.",0,0.918032787,0,0.865413033
62,0.506877661,"Privacy. Facebook are made it easy to steal people privacy. It is creepy because they can spy on your websites. Moreover, they hand the info to a third and fourth parties ...etc. It is all about business and we are for sale by the company. Shame on Facebook.",1,0.919354839,0.919354839,0.866283062
63,0.505716801,nazi lovers. facebook protects nazis and sells all of your private information,1,0.920634921,0.920634921,0.86714579
64,0.501682043,Boycott Facebook. Download if you want your personal data sold and shared with 3rd parties,1,0.921875,0.921875,0.868000934
65,0.497930646,"No privacy, no rights. Facebook is a very invasive app into you privacy, it snoops into your online shopping and then bombardes you with ads. There is no freedom of speech and there is not a group for everyone, if Facebook doesnt like your thing they ban it. You have zero rights with this terrible company. DO NOT JOIN",1,0.923076923,0.923076923,0.868848257
66,0.49366191,"I dont understand. Besides basically our full life, as you already have to AOL, xanga, MySpace. This app is ideal for Facebook interactions. You have full control of what you getNotified for all privacy settings etc. formed with meta-there are more things that you can do and control ultimately you pay a price to have full control but I dont understand the issue knowing that youre On social media a public domain. Facebook is great on browser and app and I prefer the app because of the updates I prefer the browser because of the old formation that is still available that very much helps with networking. Give it a chance",0,0.909090909,0,0.855683889
67,0.493538082,"Spreads disinformation. Facebook knowingly allows the spread of dangerous disinformation. They do not remove posts that violate their policies, and they dont remove posts that are detrimental to society, the environment, and democracy.",0,0.895522388,0,0.842912488
68,0.492641777,Facebook needs to do better. On facebook if you report something as bad as people leaking your address they dont care. They wont do anything about it.,0,0.882352941,0,0.830516716
69,0.490946651,Garbage. Facebook is no longer safe in any way Dont put up pictures because they are now property of Facebook and you no longer have rights (even a picture of your own child). Any information is sold about you to whoever wants to pay or it. COMPLETE SECURITY BREACH,1,0.884057971,0.884057971,0.831292676
70,0.490456283,"Negative 5 stars  WARNING. Stay away from this app and messenger.Do you think messenger is private?Think again, Facebook monitors all conversations.If they have your credit card information, they will sell it.They look at your private photos.Nothing is private.This is a corrupt company that should be shut down.DO NOT GET THIS APP or ANYTHING ELSE that has any affiliation with FACEBOOK.",1,0.885714286,0.885714286,0.832070128
71,0.489791125,Censorship and ads. I dont use Facebook much anymore. Their censoring and phony fact checking ends any discussion of the high-impact issues. Even murmuring to yourself gets you a bunch of ads related to what you murmured about.  I still post pictures of vacation and the dogs.,0,0.873239437,0,0.82035083
72,0.48872003,"Trojan horse. Facebook will become a trillion dollar company because of ALL the information they have on each and everyone of you. Be careful, if its free, you Are the product",1,0.875,0.875,0.821109846
73,0.487537414,"Lack of Security. Facebook was very quick in notifying that someone else tried to access my account. However, when I tried to report about the issue, nothing happened. Theres no customer service to make sure they are increasing security and privacy.",1,0.876712329,0.876712329,0.821871524
74,0.484590352,"Tyrannical. Facebook is a left wing, free speech hating platform that censors the truth. They also sell your personal information.",1,0.878378378,0.878378378,0.82263513
75,0.484500587,"Facebook is garbage. You are the product, not the customer.",0,0.866666667,0,0.811666662
76,0.481833398,Fraud. Facebook has always been fake and a big fraud nothing is private so be careful what you post on it,1,0.868421053,0.868421053,0.81241343
77,0.48172915,Dear Facebook. Stop selling my data and info pls,1,0.87012987,0.87012987,0.813162994
78,0.480853647,Review of Facebook. Their censorship and marketing of your personal information is highly unethical,1,0.871794872,0.871794872,0.813914685
79,0.479977459,"Lots of information stolen. Ive reported multiple accounts that are made from people that stole pictures and other information from other people. When its reported, Facebook just talks to our friend  what the heck? Take down the profile thats a hack",1,0.873417722,0.873417722,0.814667888
80,0.47813201,High tech industries spay on you because of Facebook. Facebook is bad it let the highTech company to access personal information. Its supper stupidity,1,0.875,0.875,0.81542204
81,0.477682352,"Leave us alone. I think Facebook has the nosiest staff. I guess thats why they work for Facebook. I dont want to see your incompetent fact checking. I dont care how celebrities feel about covid, masks or vaccines. I dont need a covid info fact sheet every time someone is sick. WE ALL KNOW ALREADY Unless someone has been living under a rock for the last year and a half, we already know You are tech people- not scientists, not social workers, not doctors, stick with what youre good at - tech and playing video games in your mamas basement.",0,0.864197531,0,0.805355101
82,0.476396173,Do You Like Privacy?. If you like privacy you will delete you Active Facebook Account. Facebook sells personal data to malicious third party groups and other malicious groups.Dont use Facebook.,1,0.865853659,0.865853659,0.806092888
83,0.475943804,Facebook SPIES ON USERS. This app used to spy on you and everyone you know.,1,0.86746988,0.86746988,0.80683237
84,0.475350916,Facebook is Privacy nightmare. FB will sell your soul (or data) to the devil for a few cents if they could If you read their new terms of service you would be terrified. You have no privacy for you or anything on your phone,1,0.869047619,0.869047619,0.807573028
85,0.474907935,Its Facebook. They want to sell your personal data and ruin your life.,1,0.870588235,0.870588235,0.808314383
86,0.474585354,Help me understand. Why do I need to provide my card information to redownload Facebook? I dont make purchases from it so why does it need my account information to login???,1,0.872093023,0.872093023,0.809055995
87,0.47203657,Shame on FB. Facebook is not a place where you can express your views freely.  You can express what FB fact checkers deem facts.  They control what you see and hear.  It is a dangerous threat to our democracy to have this social media platform able to mold our perception of the world.   All social media platforms need oversight by a third party to ensure freedom of speech.  Bad,0,0.862068966,0,0.799756501
88,0.471501917,vr. i dont want any of my social media connected to my facebook. it uses my real name which is personal information. it makes everything more difficult on the oculus 1/10,1,0.863636364,0.863636364,0.800482408
89,0.471309304,"Its all about collecting personal data. I just created a profile after months. I deleted my old account as I felt fb was into my life too much. Plus most of the suggestions were very segregated as I only had access to people who look like me despite the diversity in my personal life. I had my old account since 2015. Anyways, I created a profile just 20 minutes ago. I put a facebook cover up of my business like Ive always done in the past. Didnt put a profile pic up yet as I wanted to put one up that was really liked. I modified some settings and decided Ill come back after a break to finish. Facebook sent me an e-mail 5 minutes after signing out saying my account was disabled for breaking community guidelines. There are so many ways to connect with people in the world without this platform. If I immediately posted all of my personal information I guarantee my profile would still be up and running. These big sell out companies show their true colors every time. I dont take this personal and happy facebook did me a favor.",1,0.865168539,0.865168539,0.801209219
90,0.470836937,Facebook is trash. Facebook lies Facebook sells your data Facebook manipulates people by show them false information that fits there agenda but when you actually give out real facts and real studys they ban you for false information or dangerous individuals all facebook does is brainwash the masses and take away our rights. Facebook thinks they are so powerful they can do whatever they want like take away your first amendment rights of freedom of speech because it doesnt fit the narrative Facebook doesnt let you participate in the second amendment you try to show anything related to the second amendment and your banned for violence. Facebook is a evil communist controlled ap used  to takeaway our rights alone with Instagram and Twitter none of them allow the truth to be told all of them want world control,1,0.866666667,0.866666667,0.801936524
91,0.467661947,BoomerBook. Facebook allows bigotry and false information.,0,0.857142857,0,0.793124035
92,0.467535734,They steal too much information. Do your research in what Facebook its bias and unsafe and tracks everything you do kinda like iPhones and Google,1,0.858695652,0.858695652,0.79383677
93,0.465880364,"Disappointing. Im giving fb two stars because for awhile I have noticed people I am not associated with have pictures of my daughter on their Facebook. My daughter is only 4 years old. For what ever reason I cannot find where to make my profile completely private. The only things I can see that are private are my about me info and what ever I post/share. My featured photos cant be made private and it really irritates me that fb changed the privacy settings making it impossible for our profiles to be 100% private and inaccessible from people we dont know and arent friends with. Fb used to have better privacy settings that way when you set your profile to private absolutely no one youre not friends with can see your pictures or about me info. The more time passes and the more problems that pop up it makes me think the Facebook company as a whole does not care about its users right to complete privacy from random unknown people on the internet. I mean theres a setting to keep people from looking you up from a search engine hows that actually useful? Its useful in one aspect thats it. Id really like to be able to completely block out anyone I dont know without having to block everyone of those people, thats just time consuming.",1,0.860215054,0.860215054,0.794550515
94,0.465795606,Too much publicity. Facebook is a tool for selling and censorship,0,0.85106383,0,0.78609785
95,0.464941621,No privacy. I wouldnt download useless you want to be tracked by Facebook,1,0.852631579,0.852631579,0.786798205
96,0.464877486,Privacy Nightmare. Facebook wants way too much control over my phone and tracks a disturbing amount of data for what should essentially be just a web browser. Super creepy.,1,0.854166667,0.854166667,0.787499959
97,0.46418649,"Censorship, Propaganda and Ads. Facebooks main product is their users time. Its getting old.",0,0.845360825,0,0.779381403
98,0.462944388,Facebook. rose: The App says enjoy your friends and community privately thats a flat out lie Facebook used to be great but now it is used by the Government to spy on you and say what you can and cannot post you cant even make a joke anymore. All of the community standards people are foreigners and Obamas and Biden people since when did a Social media site that people communicate with their family and friends become a government controlled tool its appalling I really enjoyed Facebook to share with my out of town family I joined when it first came available they totally ruined it. I get scolded for everything I made a joke to my sister they banned me It has been taken over by the government and you cant post or say anything this should be against the law Then when you find another free site they take it down its sick They even spy on your messenger,0,0.836734694,0,0.771428532
99,0.462613374,Facebook is the real problem. Facebook is a scam. It can be blamed for all the problems facing society today with the number one issue being miss information. If you work for Facebook please find a new job and stop actively contributing to the problem.,0,0.828282828,0,0.763636324
100,0.461028457,I just hate Facebook. Its about privacy. At this point Im using it because forced by coworker and my job.,1,0.83,0.83,0.764299961
101,0.460254937,"Cesspool of Lies and Fake news. Cesspool of lies, politics, fake news, threats, sex and pornography, illegal immigration business and people fighting over their own 2 cents, political views and personal feelings. This social media can be used for so many illegal activities. I once reported an account of my friend that was made a copy and have been requesting us to accept her friend request and been asking for money but she said its not actually her and its been using all her details from name to photos. So what we did was report it to Facebook and the Goddamn reply was this dis not go against Facebook policy That blew me off",1,0.831683168,0.831683168,0.764967122
102,0.456259221,DANGEROUS SPYING WITHOUT USER PERMISSION. Pretty gross how Facebook was recently proven to collect plenty of user data without your permission and then use it against you,1,0.833333333,0.833333333,0.765637378
103,0.455727637,"The Truth. All that Facebook cares about is money and not the safety of us and the Facebook community. Mark Zuckerberg, bull$%+ all you want. You know the truth and what youve done, but you cant confess or address the problem. Why? Because YOU are the problem If Facebook must be shutdown, so be it. Shame on you Mark, youre the worst CEO of this social media platform You just got exposed from a whistleblower",0,0.825242718,0,0.758204006
104,0.455437452,Read. Facebook used to be great and simple of course there would be a few bugs and things but it wasnt bad the algorithm has gone awful you cant make things private anymore you used to be able to keep your personal things personal and not just entirely public even though it is a public app there should be better limitations especially for peoples family you should have better options for what you can and cannot do you used to have a choice now its either put everything out there or nothing at all i myself have used it for years its sad to see it go so far downhill and many other people have said so and its still going unnoticed facebook do better if your going to download it you should know the risks upfront,1,0.826923077,0.826923077,0.758864766
105,0.453941613,Privacy concerns. FB has become quite the big brother monitoring everything you do it seems-  targeting ads off things it apparently sees and hears you do outside of the app,1,0.828571429,0.828571429,0.759528639
106,0.453383744,Beware of Being censored. Anything that you might share regardless off being true or not Facebook will censor if they find it not to be true. Keep doing it &amp; you will be thrown out of Facebook.,0,0.820754717,0,0.752363275
107,0.45280841,Evil company. If you dont know it yet you will know it Soon Facebook is an evil company that thrives off of using people to get what they want If you get all your news from Facebook you are a lost soul. Wake up because Facebook is pushing the evil narrative that will hold you and your family down for decades if you dont stand against them They do not care about you or anybody under them and they will run you over with no blink of an eye,0,0.813084112,0,0.745331842
108,0.452322334,Bias party and concerning privacy breaches. Avoid facebook. Its only value was the marketplace and the ability to save game data. The measures they take to collect your information is concerning.,1,0.814814815,0.814814815,0.745975203
109,0.451556683,Sensorship. Facebook deactivated my account because I said this Imagine spying on the trump campaign then lying to the American people about it.,0,0.80733945,0,0.739131394
110,0.451362729,Its not about The People. Facebook is stripped you of your freedom of speech thought and individuality they sell your information its all about screwing the people we are nothing but a $ .. Im a 90 day Facebook prisoner veteran for being funny if youre sensitive and dont like one person is talking about or saying youre joking Ill get the f%$@# off my page simple . But no you need to create a profile but its not yours its Facebooks within a minute to you since are you and sell u . Negative the big bang and thats what I read this please,1,0.809090909,0.809090909,0.739767389
111,0.449578643,Steals Information. Making Facebook required to run devices and apps owned by the user while Facebook steals private information should be illegal.,1,0.810810811,0.810810811,0.74040742
112,0.448194653,Facebook fact checker. You share post of other peoples and  Facebook block us with up to 3 months without be able to share nothing .,0,0.803571429,0,0.73379664
113,0.446531236,Facebook is liberal garbage. They sell your private information. Dont download this crap.,1,0.805309735,0.805309735,0.734429499
114,0.44629097,"What gives?. I was sent inappropriate pictures by a male pretending to be a female the other day and I reported the account as a fake account and was told you will not do anything about it? I have reported a few different accounts now and one thing that always bugs me is that I can not give a reason as to why i feel the account needs to be reported outside of your very limited select one option choices.I am one of many people who do network marketing as well as use fb as a way to keep up with my friends and family, I would greatly appreciate it if you could actually fix your bugs and stop allowing your political standings to be a part of deciding what is and isnt allowed to be posted/deemed as reason to report accounts. I agree with many of the other complaints, that Facebook used to be a fun place where i could share my thoughts and rant on whatever i wanted to without fear of (will this be accepted by their political mindsets?) politics should not be able to run a social media platform like this, especially one that is supposed to be a safe place for all. Get your act together Facebook.Also can you do something about the bugs??? Fb is taking forever to load and comments are not posting plus I cant react to anything at all in my newsfeed .",0,0.798245614,0,0.727987135
115,0.445585102,Privacy is Nonexistent. I am hoping to see Facebook broken up.,1,0.8,0.8,0.728613334
116,0.445510715,"Untrustworthy. Facebook is creepy, immoral.",0,0.793103448,0,0.722332184
117,0.444060922,Tony p. Apple made it so permission is needed to track what I look at on other sites yet its pretty obvious youre not following this. I like what Facebook fundamentally stands for originally but its getting to the point where the constant tracking of everything I look at is getting old how about a reply from you explaining this,1,0.794871795,0.794871795,0.722952181
118,0.443199128,"Ok but it wants to know my personal informations. This app wanted to know what my personal informations are. I only used it to find my family (my Moms side families), but someone is trying to bully my family and me. I wanted her (Heidi) to be removed off from FB, so my family and I would be safer.",1,0.796610169,0.796610169,0.723576401
119,0.441879094,Intrusive. I dont feel my privacy is valued. But everyone insists on doing everything on Facebook so either I download it or be left out of everything.,1,0.798319328,0.798319328,0.724204493
120,0.440692604,Trash. Facebook is trash. They sensor your freedom of speech. F**k Facebook,0,0.791666667,0,0.718169456
121,0.440444827,No privacy. I was checking my privacy sitting and I found out that Facebook has been recording all my web browsers history( Microsoft edge and Google Chrome) be extra careful from this awful platform META,1,0.79338843,0.79338843,0.7187911
122,0.43730998,"They dont value Truth. The fact is Facebook has become something I dont think it was ever intended to become, the app is trash, tons of technical issues and these people swear they are rulers of all freedoms. Its okay though because before they know it their perception of themselves will become what truly is, and thats nothing but a freaking social media app. Check your ratings here it speaks for itself.",0,0.786885246,0,0.71289937
123,0.437282085,"Scammers Allowed. Even if you report a fake profile, Facebook will do nothing. So many scammers",0,0.780487805,0,0.70710344
