id,socre,doc,result,Precision,,AP
1,0.63001138,"Adapt or Die. Facebook needs a new business model, since the one it helped invent is now known as cyber-stalking. It&#39;s great that they helped the world realize this is a boundary, but they have yet to adapt to said realization. They intentionally do not allow you to update the photos they have access to from the app. If you cannot select which photos you want to share with them, you may be more inclined to share all of your photos out of convenience. Given their business is based on nonconsensual data harvesting, it&#39;s not a surprise to me.",1,1,1,1
2,0.620232344,"The People make this app Entertaining. Other than that, they steal your data. From who you are, where you live, your address, your phone number, your location. Your contacts, your email address. In some cases your credit card information. They track what you do. What you view on online stores. You can personalize the ads yes. Facebook also controls the ads you see on YouTube, Google, Amazon, Etc. I always deactivate my profile until I log back in for it to reactivate. Thats your best bet. If you dont use Facebook. Just do that, dont just delete the app. Youll be surprised how easy it is to find out information about someone. If they have a Facebook account. Even if you havent used your profile in 10+ years. It is still there..just deactivate it.",1,1,1,1
3,0.605604529,"Customer support. I enjoy Facebook. But the customer support is crap. Then ensuring your safety and privacy is a lie. I had my Facebook hacked and so have a bunch of other people. There is no way to directly contact someone and even though several people have reported my Facebook as hacked they still have not done anything about it. The guy who hacked my Facebook is conversating, laughing, and messing with my friends and family including my kid. Thinking this who thing is a joke. I have personal information on my Facebook and they are not protecting my privacy. I am scared for my safety and the information he most liky accessed including my home address. They need to figure out a better system and take care of issues like this immediately. They want to kick people off for petty issues but will not help resolve important issues. Facebook is a good way for keeping in touch with family and friends but they do not ensure your safety or privacy like they say they do.",1,1,1,1
4,0.605412006,Facebook selling our information. Its really bad.,1,1,1,1
5,0.596261144,"Invasive, Avoid at all costs. Bias party and concerning privacy breaches. UPDATE: So I had this one individual contact me condescendingly about how much he doesnt like the price at which Im selling something at marketplace and then reports me, facebook without gathering any data terminates my account. Facebook has grown to be a disease to our nation and individuality. Privacy is not respected whatsoever, the most invasive site on the web next to google.Avoid facebook. Its only value was the marketplace and the ability to save game data. The measures they take to collect your information is concerning.",1,1,1,1
6,0.593673944,"Facebook cares ;). If youre looking for a single location where companies cane mine data about who you are and what you do, and of course how you think, this is the app for you. Not only can you train an ai to recognize yours and your acquaintances faces, as well as attribute that data to your views and reluctant needs, but you can create a web of data to pigeon hole yourself into the projected personas you created, and any possible way that corporations can market yo your deepest insecurities. What do you have to lose?",1,1,1,1
7,0.592628241,"Standards. Facebook is trash, dont let them harvest your personal information like that.",1,1,1,1
8,0.592131555,"Your personal information is opened for sell. Beware, you are like a sell cow in catalog, and facebook selling all information and doesn't care you anymore",1,1,1,1
9,0.587479234,No privacy. The problem with Facebook and all social media that your information is everywhere. They sell your information. And they also give the government your information.. its not about gather with friends. Your data is sold The same thing goes for Google . Listen to your Conversations and report back to there makers. A database is made. They can use this to incriminate you . Even if you havent done anything wrong. Youre signing your life away and you dont even know it. They are contracts you cant even read them. It would take you weeks to read . Even if you delete your account it doesnt guarantee the use doesnt guarantee you complete 100% delete of your data its sold . Dont be fooled. believing youre safe. Your address and phone number out there. Why do you think so many people your phone number. Think about before you sign,1,1,1,1
10,0.584421873,They just care about selling your personal info. All they care about is how much of your personal information they can gather and sell. Facebook has went way downhill since it first started I only used it mainly for selling on marketplace and business networking but now i wont even be using it for that after they removed my latest marketplace item for no reason when i have been buying and selling on marketplace for years and have a 5 star rating Facebook is worthless,1,1,1,1
11,0.581443369,Privacy. Just look below to all of the data that Facebook uses that is linked to you for their profit.big thumbs down.,1,1,1,1
12,0.577362239,Biased. Facebook sells your private information to third party companies. It tracks you and send those information to third party companies as well. It is selective and may remove your post with dictated nonsense reasons.,1,1,1,1
13,0.571443617,Lets start with. The fact that facebook released data showing personal information to undisclosed persons. They have been hacked and Ive been shadow banned for sharing my opinions. I can not get on IG (owned by Facebook) and go live because Ive been banned. I cant add anything on marketplace across platforms for some reasons. Facebook is now being exposed in the news for hurting the minds of children and mowing about it and still putting profits over anything else. Disgusting app by small hat CEO.,1,1,1,1
14,0.569917917,"Facebook. FB hides under a free social communication tool. They track us, they locate us, they algorithm our social and mental acuity - I own a marketing agency and while I need Facebook to market our clients products - I know what they are. There are so many privacy infringement violations and social travesties. They will continue to hold society hostage and thus my agency will continue to thrive sigh.",1,1,1,1
15,0.569413364,Privacy Violations. Download your data and you will learn things about you that Facebook shouldnt know.,1,1,1,1
16,0.567641497,"Facebook reality. Facebook has changed a lot now, they  try to control what you see and share, they restrict your account when they feel or want to without you making something bad, wish we could be free to share our thoughts like we used to do before.",0,0.9375,0,0.9375
17,0.56570667,"HAD TO COME BACK AND GIVE ANOTHER 1 star REVIEW. Facebook use to be a place where you can be yourself, express yourself, and have fun on a ENTERTAINMENT APP. Facebook not even for entertainment anymore. They take everything extremely too serious. You cant quote anybody especially if they say something thats out of the regulations of Facebook. Facebook use to be a app I use to come to for entertainment and JUDGEMENT FREE zone. Now I dont even feel safe with posting. If you re share a post that was false information but you didnt know, they put your account in warning or restricted status. SINCE WHEN DID FACEBOOK BECOME SO SENSITIVE????",0,0.882352941,0,0.882352941
18,0.565525055,"Thank you Apple for guarding our privacy. Over the past year, Facebooks true intentions have been revealed. The world finally has gotten a glimpse at the man behind the curtain (a certain freckle skinned curly haired young CEO). Facebook does not care about choice, disclosures, or privacy. They want to control the entire experience. Many thanks to Apple for standing up to this very corrupt company and making it so users have a choice about such things as tracking. My only suggestion is to Apple: stop with the soft language when asking users if they wish to allow an app to track. To Facebook: your day of reckoning is upon you. The cat is out of the bag and the world is fully aware of your despicable behavior. Users are shutting down your tracking ability, advertisers are reconsidering their allotted Facebook advertising budgets, and Congress is debating how to real you in.",1,0.888888889,0.888888889,0.882716049
19,0.562587559,"Get your family off the app. Their information is being stolen because they dont understand how selling information works. Try to get your family, especially elders and children to stop using the app, so much private information gets shared through Facebook because they believe they are posting privately when most of the time they very much arent.",1,0.894736842,0.894736842,0.883348723
20,0.560204387,Horrible when requesting help. My account was hacked and all the options they gave was no help. Once people change your profile information there is nothing Facebook does. Ive never seen a company have no tech help you can call foe assistance. If there is a phone number it is not easy to find. I will limit my Facebook use to next to nothing outside of a Facebook live video that is done. But outside of that I will not recommend fb to anyone and will warn everyone I know.,1,0.9,0.9,0.884181287
21,0.5564816,Facebook is a scam. They dont stand by their privacy and security at all. My profile got hacked that I had for 12 years and I reported it at least 30 times and every one of my friends on Facebook reported it. And Facebook did nothing about it. Never deleted the page or anything and I had a lot of personal information that the hacker used trying to spam others that where friends with me on Facebook.,1,0.904761905,0.904761905,0.885161316
22,0.556459963,"I hate that I need it. Facebook steals all my personal information but because of business, I have no choice but to use it. If youre a manager please try other apps for your work groups.",1,0.909090909,0.909090909,0.886249025
23,0.555247605,"FCc. You are not allowed to track personal details on our accounts. I am reporting facebook and all the requests to review things that don't work.  I hide things and it doesn't work, disable doesn't work basically Facebook is old and nothing works goodbye FB done had to give a star or it wouldn't post. I would give negative 500000",1,0.913043478,0.913043478,0.887414001
24,0.552628577,"Facebook is a Cesspool. Cesspool of lies, politics, fake news, threats, sex and pornography, illegal immigration business and people fighting over their own 2 cents, political views and personal feelings. This social media can be used for so many illegal activities. I once reported an account of my friend that was made a copy and have been requesting us to accept her friend request and been asking for money but she said its not actually her and its been using all her details from name to photos. So what we did was report it to Facebook and the Goddamn reply was this dis not go against Facebook policy That blew me off",1,0.916666667,0.916666667,0.888632862
25,0.550718248,"Facebook doesnt care about your security. I can report obviously fake profiles posting scam links & or malware, and every time they decided not to take the profile down.  The company consistently puts users and their information security at risk by their poor business practices and standards.",1,0.92,0.92,0.889887548
26,0.549059451,facebook is cancer to society. Years and years of user data collection and privacy issues on a platform that caters to instigation and division.,1,0.923076923,0.923076923,0.891164062
27,0.545751333,"Completely Policed and Suffocates Freedom of Speech. The only benefit Facebook still has is connecting with friends and family I know closely. Other than that, they use their algorithms to tag normal factual things you post or say regarding current topics as false or requiring fact checking if they are contrary to Facebooks agenda. The few good things it provides are severely outweighed by all the toxic fear-mongering topics that are shared in accordance with Facebooks agenda. And good luck if you have facts or opinions that contradict this agenda youll be labeled as a false information spreader. Facebook is doing nothing but stressing people out and causing them to become more polarized and divided than ever. Shame on you, Facebook",0,0.888888889,0,0.858157986
28,0.544671714,Facebook. Facebook sells your information. Its not a trusted site. Really should dismantled.,1,0.892857143,0.892857143,0.859397241
29,0.542054057,Privacy Issue. They are selling your data and targeting you with ads. Grave culture within the company.,1,0.896551724,0.896551724,0.86067843
30,0.541479051,"Write to your legislators. Privacy is important. Today Facebook has monopolized the social media applications in order to promote consumerism by selling our data. However, Facebook refuses to incorporate measures to protect people from human and child trafficking, drugs, cults, and racism. There needs to be laws on the books to hold those at Facebook accountable as they are the middle man. Finally, where are we going with this platform which reeks of entitlement? When you think about how corporations donate to political campaigns and what this platform has done to ruin presidential elections such as the one won by Trump- I say deactivate my account. I would rather talk to my real friends in person. Pick up a phone- reach out and touch someone. Personally, I would prefer it to a GIF or a like.",1,0.9,0.9,0.861989149
31,0.541136086,Need to fine another place. Facebook is not safe for privacy,1,0.903225806,0.903225806,0.863319364
32,0.537781417,"FB has gone down hill. Interesting how Facebook can link all your personal data to everything out there leaving you wide open, but when it comes to censoring information ? They try to force their beliefs and opinions  on you that are not based on facts or science.  They rely on Google for information? Google is also owned and controlled by those with an agenda. Dont believe me? Learn how to research. Its the epitome of hypocrisy.  Facebook cannot differentiate between real journalism and hyperbole and try to force their opinions on you. How old do you have to be a FB user and yet we are treated like 5 year olds. Punishments are common for posting against their political ideologies disguised as community standards. Whose community? Not mine.   It is mind blowing how some can be fooled by the floral language. Seems like Facebook is owned by the Chinese Communist Party. So sad. Communism paints a glorious picture of living in an ideal society but history proves time and again that dictators love control, power, and oppressing those beneath  them.   If I could give negative stars, I would.",1,0.90625,0.90625,0.864660946
33,0.536866605,Not forthcoming on the apps privacy risks. Facebook is supporting human trafficking. We have been trying to locate my sister that has been trafficked through Facebook overseas. Facebook has been non compliant with authorities in our investigation. Facebook is a criminal enterprise.,1,0.909090909,0.909090909,0.866007309
34,0.534744978,"Facebook Uses You. There are well detailed complaints already posted about the failings of Facebook. We\'ve long been aware of the crimes and offenses of the Zuckerberg- lead company. Our hope is that their spying, stealing, and general indifference to you and us catches up with them, and that they come to realize their egregious offenses, which are perpetrated against us, freedom, and the privileges they enjoy but deprive of others, such as privacy. Bravo to those ex-Facebook employees who have spoken out against this corrupted company.",1,0.911764706,0.911764706,0.867353115
35,0.533742189,"Im deleting Facebook. Facebook has become way too invasive, and sells your personal information. Delete this crap basket while you can. I am.",1,0.914285714,0.914285714,0.868694046
36,0.53130883,Horrible privacy. I cant stress enough how bad mark Zuckerberg and the rest of Facebook is with privacy. Thanks for exposing our credit cards and other data,1,0.916666667,0.916666667,0.870026619
37,0.528749764,"Data Mining. Facebook mines your datas and sells it to Cambridge Analytica to use for targeted advertisements and more. Anything you put on there is up for grabs. Be careful. Ive deactivated for a few now and suggest all of you to do the same. They now change their name to Meta to try to leave their sketchy past behind them, but dont be fooled, they are not changing their practice at all. It just goes down hill from here. Be Warned.",1,0.918918919,0.918918919,0.871348032
38,0.5271312,"Easy Access, Uncensored, and Unprivate. I give one star to FACEBOOK, because any knowledgeable hacker can hack your profile on this website it is NOT PRIVATE it can be easily accessed of your account your PICTURES, your IDENTITY and any messages sent via MESSENGER can be accessible on FACEBOOK so if your looking for privacy my suggestion and advice dont seek SOCIAL MEDIA.",1,0.921052632,0.921052632,0.872656048
39,0.526350856,Facebooks Inability to Privatize Profile Is Disgusting. The fact that they allow photos of my kids out float out there without my permission is absolutely horrendous. The photos are not from any family members. They are school pictures that allow name labeling without our permission.Facebook will sell your data to the next highest bidder. Run away from this app.,1,0.923076923,0.923076923,0.873948891
40,0.526229978,"Facebook has 0 support and steals your information. I tried to make a Facebook account and it said my birth name wasnt real, so when I tried to click on the support option it tried to make me give them a picture of my ID with fine print saying theyll keep my ID in their database. There is no way around this because Facebook has 0 contact methods including phone calls, live chat or even email. Pathetic",1,0.925,0.925,0.875225169
41,0.52548784,"Facebooks CEO,admins, ignorance and carelessness. Facebook is not safe anymore. Nobody can have personal online privacy without local or unknown people placing their force fed unwanted advertising or personal blogging junk on others newsfeeds. Nobody can express themselves and their entitled opinions anymore without someone feeling so offended that they have to cry like a little 5 yr to Facebook admins as if the sky was about to fall on them. Facebooks community standards are nothing but a joke. Whats the purpose of having Facebook, Twitter and so on if one cant enjoy themselves safely and securely?",1,0.926829268,0.926829268,0.876483805
42,0.523882389,Steals your data to make money. You are their product and they make money out of you. It should not be Facebook it should be called .. you know.,1,0.928571429,0.928571429,0.877723987
43,0.523508787,American-patriot. Facebook is a criminal organization who will use our information to spy and find who we are so they can censor everything we say know all about us because of our pictures and everything we say,1,0.930232558,0.930232558,0.878945117
44,0.521675646,Privacy exposure. I advice every Facebook user to delete the app and deactivate their account. I just found out that so many people private messages and pictures are being monitored by the administration. I saw my naked videos and pictures in a database since I started looking into it. A word for the wise is quite sufficient,1,0.931818182,0.931818182,0.880146777
45,0.521375537,"Ehh. Ive been using Facebook religiously since 2009, back in July someone hacked my Facebook and Instagram, since they were intertwined, and there was NO physical way for me to get it back since they changed my email, password, and number. When reported I get a notification on my new facebook saying that someone reported the profile because theyre claiming/ pretending to be me but then yall reply saying that they are me and they didnt cross any community guidelines. They had been sending a picture of my drivers license to people through messenger trying to scam them and Ive received messages being cussed out because my old profile ripped them off. Really only keeping it around because thats how I keep up with friends since theyve gone all over the place since graduation. I lost pictures, conversations with friends that have passed, and things that Ive been sharing/ memories I had made as statuses over the last 12 years. If yall want it poppin like it use to be, you need to take what complaints are out there into consideration and fix it. Also need to monitor for scammers when reported and do something about it.",1,0.933333333,0.933333333,0.881328701
46,0.521222532,Tech support and selling your information. Tech support is horrible not to mention they allow companies to use your information. Facebook is evil on many levels but screening and filtering to their benefit is #1 priority.,1,0.934782609,0.934782609,0.882490742
47,0.521031797,"CUT OUT THE DRAMA. Remove the following online activities and behaviors immediately. 1. Harassment, discrimination, retaliation.  2. False reports, attention-seeking.3. Scams and cons.4. Require identity verification and background checks for those new users or current users who knowingly abuse their privileges to use Facebook and its affiliated platforms to abuse other users, groups, businesses, or government offices; and vice versa. 5. Implement a zero tolerance policy for any and all violations of these mandatory new requests to Facebooks policies and procedures. 6. Permanently stop tracking all current and new users whether they opt-in or out of Facebook tracking. 7. Implement secure biometric login utilizing all the current mobile and computer manufacturers individual device biometric settings. 8. Improve the overall security and privacy of Facebook and its affiliated platforms to enhance the experience for all users regardless of age, cyber-knowledge, or frequency of social media platform usage.",1,0.936170213,0.936170213,0.883632858
48,0.520762086,"Your privacy is being assault by Facebook. Dont trust further this app and company :Facebook, Instagram and WhatsApp. They sneak into your privacy data and sale it and make all kinds of profit from it.",1,0.9375,0.9375,0.884755091
49,0.52056551,Promotes Human Trafficking and other inappropriate behavior. This company believes they possess the virtual right to promote disgusting behavior. Facebook needs to either fix its privacy issues or get KICKED OFF THE APP STORE.,1,0.93877551,0.93877551,0.885857548
50,0.517765462,"Left leaning. Facebook collects too much information on its users. Also censors what THEY deem false information yet doesnt give the user any room to prove their argument. Labeling content false for all to see.   This is supposed to be a social platform, NOT a newspaper",1,0.94,0.94,0.886940397
51,0.51728934,"Facebook manipulates you. Facebook preys on your emotions to get you to use their services more frequently, and for their own profit. Dont be used by anyone. Do not use their services any longer.",1,0.941176471,0.941176471,0.88800385
52,0.516818404,"Help me out. Facebook, you can change the culture, facilitate revolutions in foreign countries, influence US elections, and be the sole arbitrator for what content can be seen on your communication tool that is used by millions around the globe, but you cant help me to regain access to my FB account that has been hijacked by someone using a hotmail account despite my following all of your protocols.",1,0.942307692,0.942307692,0.889048154
53,0.515146017,DONT USE THIS APP. Not only will they censor what you believe in. Facebook sells your information which can lead to fraud calls or even death threats,1,0.943396226,0.943396226,0.89007359
54,0.514877439,"Facebook App uses up Way Too much memory. Facebook platform/app is thumbs up as far as a social app , but I completely DISAGREE WITH FACT CHECKING It definitely VIOLATES MY FREEDOM OF SPEECH AND MY PRIVACYJoining Facebook Im offered choice if I want my account to be PUBLIC or PRIVATE AND FACEBOOK OFFERS CHOICES/OPTIONS FOR THE POSTS THE USER MAKES EITHER PUBLIC OR PRIVATE Now LETS GO BACK TO THE INITIAL CHOICE OF MAKING YOUR FACEBOOK ACCOUNT PUBLIC OR PRIVATE:1. My ACCOUNT IS PRIVATE 2.MY FRIENDS LIST IS PRIVATE 3.ANYTHING I POST IS PRIVATE AND ONLY MY FRIENDS AND FAMILY CAN VIEW MY POSTS , COMMENTS, AND PICTURES UNLESS I CHOOSE TO MAKE ANY OF IT PUBLIC.So if my account is not viewable in any way besides a profile picture, WHY ARE STRANGERS CALLED FACT CHECKERS ACCESSING MY PRIVATE PERSONAL INFORMATION AND DECIDING WHATS ACCEPTABLE AND WHATS NOT? IT COMPLETELY WRONG AND VIOLATES MY CONSTITUTIONAL RIGHTS TO FREEDOM OR SPEECH AND MY PRIVACY and along with a whole list of many other issues I will not post.. ( LETS NOT MENTION SCAMMERS AND CYBER CRIMINALS SPOOFING AND SCAMMING PEOPLE AND MAKING FACEBOOK ACCOUNT WITH YOUR NAME AND PICTUREIt was great in the beginning but now , personally feel violated in many ways.. what a shame..RUMBLE RUMBLE RUMBLE",1,0.944444444,0.944444444,0.891080457
