id,socre,doc,result,Precision,,AP
194,0.296115637,"Facebook is just awful now. *UPDATE* after going through the annoying ad section THAT YOU CANNOT TURN OFF I have hidden over 3 thousand ads...and guess what..literally every three posts..every three..there is an ad. And I am talking about very specific stuff Ive talked about in messages like texting and Facebook messenger. So what happened to them not datamining us? Sucker burger is nothing but a lying nazi who is stealing peoples information and selling it to advertisers First of all when Facebook dating came out I LOVED it, 100% better then any other site Ive used. But now me and 100s of others have been getting the error its not you, its us or try taking a break. I would come on after 1-2 days and click like on one person and instantly get that error. Ive uninstalled the app, updated the app, logged out and in, cleared the cache and still have it after a week. USELESS Second the people who run the app of looking at the reports are useless, there was a picture of a penis on my news feed and when I reported it I got a this doesnt go against community standards. People posting brand new pages that are completely fake, advertising they are a celebrity or doing a give away and to give their credit card info. Facebook allows people to be scammed and their support team will allow these pages to stay up and will not take the reporting seriously. Third which is the biggest...THE ADS Oh god there is at least 3 ads in everyones videos, literally every time you scroll down after 3 posts from friends there is a sponsor ad. There is NO option to hide all ads, no option to skim them down. They have a section where you can hide certain ads but guess what...the moment you do that it will replace that ad with another one. This site clearly still is using peoples private information, its allowing people to get scammed and its allowing people to make threats, post nudity and pick and choose what to ban. Actually my friends account got banned for saying god bless your family and he was banned for a week. I told him he should make a law suit against Facebook for religious sensory This app has went downhill more and more, something needs to be done about this crappy social network.",1,0.716494845,0.716494845,0.60931375
195,0.294617146,No privacy. I do not trust this social media site.,1,0.717948718,0.717948718,0.609870853
196,0.293493211,"The leak of privacy. FB is the worst social media alongside instagram viber and whatsup where you privacy is definitely ruined The only reason Ive been keeping this peace of Zuckerberg is, that Im waiting for something replacement of one from Apple.",1,0.719387755,0.719387755,0.610429613
197,0.291469723,Privacy on posts. I do not understand why my privacy option in settings on who sees my posts was taken away. I should not have to go into each post and manually change the audience. I now see why Meta is under investigation. Yet you claim to be so secure for people. Obviously that was a lie.,1,0.720812183,0.720812183,0.61098993
198,0.272805661,Violations of Privacy for Starters. Be careful what you Google. I googled a mild anti-depressant. Then my feed was flooded with all kinds of anti-depressant ads suicide health info etc. Why do I get ads for dating apps when my profile says Im married?I got 2 warnings in 1 day. One was from a private group I created 2 years ago a support group for sp ed parents. It never took only a few posts in it and then it was dormant for over a year. I got a warning over this and there was nothing that bad in it. Conversation I had been going on all day and my friend was out to dinner and it continued on FB and others jumped in. I made the last comment there are many laugh emojis. I was told it went against their standards and they removed it. I follow 2 politicians. I see the nastiest stuff but they dont do anything about that. I reported when I saw that someone called someone s fng c. Checked a couple days later. Still there   If you see an item such as a T-shirt you look at then flooded with more T-Shirt ads I purposely cut my friends list down to just under 60. Enough of the drama. I staying in touch with friends and family not in the area and local family during the pandemic. Sharing pictures. Constantly have to scroll to find this. I was staying on Bc our school PTO puts out info or parents can ask questions.Are they even violate the privacy of that Public schools To answer someone above there is no technical support. You have to try to find the answer on the Internet.Maybe instead of spending so much time in feeding our privacy they could use that time more wisely and create technical support. Im done as soon as my family and I find a better way to stay in touch. Looking like text/email.Instagram is better but not by much,1,0.722222222,0.722222222,0.611551709
199,0.256923914,privacy. Its have zero privacy,1,0.72361809,0.72361809,0.612114857
200,0.233735815,No privacy. Also they dont watch the content close enoughLots of inappropriate content that is not taking down even if reported,1,0.725,0.725,0.612679283
